,text,crowd_label,conf0,conf1,itemID
0,"RT mention .mention said heUad love his daughters if they were gay, but his voting record says otherwise #GOPDebate url",0,0.6731,0.3269,2182
1,"Topics left out of #GOPDebate: 3.) Despite its centrality to so many important issues, economic inequality was not mentioned once. #GOPTBT",0,1.0,0.0,2995
2,RT mention F**K mention and those who would actually abandon their conservative values in support of his ridiculous candidaU_,0,0.6264,0.3736,5101
3,Most depressing thing about #GOPDebate is that there will be no Jon Stewart on mention to make us laugh through the tears #JonVoyage,0,0.6458,0.3542,463
4,RT mention I'm really really really pissed off at FOX News for what they did to mention #GOPDebate  #GOPDebates _Ua14_Uau,0,1.0,0.0,1588
5,mention It wasn't a debate.It was an effort to bring mention down. I see why he would not pledge #GOPDebate shame on mention,0,0.6691,0.3309,3040
6,Definitely in need of a new tax system. #GOPDebates,0,1.0,0.0,2449
7,RT mention I need to order another green apple martini to process what the hell just happened. _Ua14_Uau #GOPDebate  #GOPDebates,0,0.6708,0.32920000000000005,716
8,I wonder if the 14 people in the audience were just on their way out from the Don Henley concert and stuck around.  #GOPDebate,0,1.0,0.0,4939
9,Only in America could Trump be a serious contender to lead the country #GOPDebate,0,1.0,0.0,998
10,"RT mention Wow, everybody's tweeting about mention mention bad treatment of mention and #GOPDebates!  Agreed!",0,0.643,0.35700000000000004,1319
11,Jeb Bush underperforms at the #GOPDebate,0,0.6813,0.3187,2153
12,Well that's unfortunate. #GOPdebates  url,0,1.0,0.0,1143
13,Zero questions on deflategate. #GOPdebates,0,1.0,0.0,3921
14,RT mention Huckabee. #GOPDebates url,0,0.6629,0.3371,129
15,RT mention Jeb Bush reminds me of elevator music. You hear it but you don't listen. _Ua14_Uau #GOPDebate  #GOPDebates,0,1.0,0.0,22
16,RT mention 67 honorary degrees Ben Carson has and still has no brain! #Republicandebate #GOPDebate,0,0.6409999999999999,0.3590000000000001,1990
17,"RT mention But mention supporters are saying he was treated ""unfairly?"" Yea... Right. #GOPDebate url",0,0.6296,0.3704,2341
18,"""Mr.Trump, you've called women fat pigs, dogs, slobs, and disgusting animals...""
""Only Rosie O'Donnell.""
*laughter, applause*
#GOPDebate",0,0.6512,0.3488,2454
19,RT mention Fox News is obviously trying to influence the makeup of the Republican field. _Ua14_Uau  #GOPDebate  #GOPDebates,0,0.6778,0.32220000000000004,398
20,RT mention Jeb Bush reminds me of elevator music. You hear it but you don't listen. _Ua14_Uau #GOPDebate  #GOPDebates,0,1.0,0.0,357
21,Who needs coffee in the morning to get fired up when you can just talk to your co-workers about the #GOPDebate?,0,0.6649,0.33509999999999995,3592
22,RT mention Fox is cherry picking the candidates. Jeb gets the softball questions. _Ua14_Uau #GOPDebates  #GOPDebates,0,1.0,0.0,3543
23,"RT mention ""I bribed politicians and it worked! And that's why you should vote for me."" - Trump #GOPdebate",0,1.0,0.0,800
24,"RT mention 10 straight, wealthy, men suddenly the authority on LGBT, affordable h/care + women's reproductive rights

#GOPDebate U_",0,0.6667,0.33330000000000004,5238
25,"JonathanFarrel7: JonathanFarrel7: luciabrawley: What is the Christian litmus test? Let's refer to the Constitution, shall we? #GOPDebates #U_",0,1.0,0.0,1863
26,RT mention Santorum just compared #SCOTUS's marriage ruling to Dred Scott. Here's why that analogy is nonsense: url,0,1.0,0.0,3098
27,"Trump to America: ""you suck""  #GOPDebate",0,0.6553,0.3447,1994
28,"RT mention Disappointed that #Trump didn't talk about his #craftbeer called, F**k Your Hair? url #gopdebate url",0,0.6304,0.3696,6172
29,RT mention This is a complete _U_ with plenty clowns. #GOPDebate,0,1.0,0.0,5935
30,"RT mention I am wondering what Fox is up to with THIS debate -- get rid of Trump, Paul, Cruz, Carson? _Ua14_Uau #GOPDebates  #GOPDebate",0,0.7105,0.2895,1318
31,"RT mention GOD IS A WOMAN, AND SHE'S PISSED. #GOPDebate",0,1.0,0.0,2440
32,RT mention Bummed that we didn't get to watch a single candidate flounder over climate change #GOPDebate,0,0.6548,0.34519999999999995,3584
33,Scott Walker chooses killing mother rather than aborting unborn embryo. This is reason other countries give us that funny look #GOPDebate,0,1.0,0.0,553
34,RT mention I need to order another green apple martini to process what the hell just happened. _Ua14_Uau #GOPDebate  #GOPDebates,0,0.6526,0.34740000000000004,4267
35,.mention Saw his shadow at #GOPDebate so he'll be with us for another six weeks.,0,1.0,0.0,3436
36,"RT mention When I think of wall, I think of communism. I don't think Saint Ronald Reagan would like this. #GOPDebate url",0,0.6126,0.3874,4037
37,>mention has now spent more time attacking mention on Twitter than he spent on any #GOPdebate subject. url,0,1.0,0.0,5974
38,"RT mention I hate #FoxNews as much as the next sane person, but I'll give it to them, they don't like Trump and aren't afraid to U_",0,1.0,0.0,5595
39,"RT mention UImention Sure, God told me I should run, and the Tooth Fairy agreed and all the Teletubbies voted yes, so here I am. #U_",0,1.0,0.0,4608
40,RT mention .mention asks good question on track record of #pro-abortion position mention Answer: obfuscation from #TrU_,0,0.6344,0.3656,5712
41,RT mention The candidates don't have to attack mention Fox is doing it for them by stoping him from speaking. _Ua14_Uau #GOPDebateU_,0,0.6404,0.35960000000000003,308
42,"someone should've told mention that he'd be on camera while in his cat fight with mention last night, not a good look #GOPDebate",0,1.0,0.0,2422
43,RT mention #GOPdebate Perry wants war! #IranDeal #Hillary2016 #UniteBlue #PDMFNB #p2 url,0,0.6705,0.3295,207
44,"RT mention I think Cruz and Trump need to band together and expose this set up job, and get rid of Bush and Rubio, _Ua14_Uau #GOPDebate  #GU_",0,0.6818,0.31820000000000004,5713
45,RT mention Ted Cruz is going to personally take away your telescope and try you as a witch. #GOPDebate,0,1.0,0.0,1215
46,Finally had the opportunity to watch the #GOPDebate and I was honestly speechless...,0,1.0,0.0,6046
47,#GOPDebate  #DonaldTrump PC Police attacks > Actual Police attacks,0,0.6577,0.34230000000000005,2565
48,"RT mention I lived here in Florida for 8 years under Jeb w bush and I swear, no more... #GopDebates",0,1.0,0.0,3947
49,Why does the media call Carly Fiorina the only female GOP candidate? Do the Democrats have more than one? Or anyone not white? #GOPDebate,0,1.0,0.0,4923
50,Wondering if I could get the Republican Party to pay for my liver transplant after playing mention #GOPDebate drinking game last night.,0,0.6211,0.3789,2319
51,"RT mention I should never be able to tell from a debate who the moderators don't support. mention really blew that yesterday.
#GU_",0,1.0,0.0,3856
52,RT mention Disappointed. mention was my media #girlcrush &after #GOPDebate think #WeAreOnABreak mention mention  httU_,0,1.0,0.0,790
53,"#Rubio, #Kasich & #Fiorina Rise, While the #Trump Show Tanks. And Fox surprises everyone w/ substantial #GOPDebate. url",0,0.6667,0.33330000000000004,2520
54,"Although the occasional dick, mention sure knows how to keep these political debates alive and exciting. #GOPDebate",0,0.6552,0.3448,441
55,RT mention Lol now the republican love Carson. Racism loves a Black man who submits! Let's stop now #GOPDebate,0,1.0,0.0,1781
56,RT mention We the American people pick the next President of United States not FOX News _Ua14_Uau #GOPDebate  #GOPDebates,0,0.6725,0.3275,5700
57,RT mention Breaking: Brian Williams just handed Chris Christie a donut to calm him down. _Ua14_Uau #GOPDebate #GOPDebates,0,0.6843,0.3157,4314
58,RT mention The Facebook logos on stage during a debate between potential leaders of our nation is chillingly sinister in such a blataU_,0,1.0,0.0,126
59,"RT mention I think Cruz and Trump need to band together and expose this set up job, and get rid of Bush and Rubio, _Ua14_Uau #GOPDebate  #GU_",0,0.7040000000000001,0.29599999999999993,4385
60,"RT mention Hi Fox panel, can you just ask Donald every single question? Hand him a shovel while you're at it so he can keep digging. #U_",0,1.0,0.0,1738
61,RT mention only complaint with the political culture of the present: the politics. The culture. And the present. #GOPDebate,0,0.6819,0.31810000000000005,639
62,mention Hates cops. #pensions #FOP #ThinBlueLine #GOPDebate #GOPDebates,0,1.0,0.0,6082
63,"RT mention ""The purpose of the military is to kill people & break things."" - Huckabee in route to being wildly transphobic. #GOPDebate",0,0.7079,0.2921,4158
64,Love how .mention BAITED .mention with women question. Then he gave .mention airtime she couldn't have paid for. #GOPDebate,0,0.6349,0.3651,799
65,"RT mention .mention mention
Cancel the primaries. Fox Party set up & anointed their man Jeb Bush
#GOPDebates #CantTrustABush url",0,1.0,0.0,4257
66,"RT mention Chris Christie, shown here swallowing a fly during Thursday's #GOPDebate #OhGodMakeItStop2015 url",0,1.0,0.0,3992
67,"Did last night really happen, or was it some kind of collective Twitter fever dream? #GOPDebate",0,1.0,0.0,5038
68,"RT mention Great to hear about critical topics like extreme inequality, poverty, climate change, racial justice at the #GOPDebate ... oU_",0,0.7034,0.2966,470
69,"RT mention Dear Dr. Ben Carson, you, Sir need a labotomy #GopDebates",0,0.6429,0.3571,6079
70,So trans soldiers can die for you Huckabee but you can't foot the bill to make them fulfilled as human beings? Really? #GOPDebates,0,1.0,0.0,4666
71,RT mention The candidates don't have to attack mention Fox is doing it for them by stoping him from speaking. _Ua14_Uau #GOPDebateU_,0,0.6421,0.3579,3046
72,which is NOT fair and balanced #GOPDebate,0,1.0,0.0,4386
73,"""I have a real foreign policy question.."" ""Wait, wait, I have this great Hillary Clinton joke."" #GOPDebates",0,1.0,0.0,1916
74,RT mention Fox News is obviously trying to influence the makeup of the Republican field. _Ua14_Uau  #GOPDebate  #GOPDebates,0,1.0,0.0,228
75,RT mention Race was discussed for only seconds. There's the Republican Party for you. #GOPDebate,0,0.6519,0.3481,384
76,#GOPDebate all those men are insane- climate change!!!!!!!!!  url,0,1.0,0.0,3307
77,RT mention .mention have you USED the families of the 9/11 victims enough times for your own benefit? #ComeOn #tcot #GOPdebate #FoU_,0,1.0,0.0,5478
78,"RT mention 2nit's Q&A was a turkey shoot. Kelly and Wallace totally emptied their clips going after mention 

Was Sad!

U_",0,1.0,0.0,3526
79,"Numbnuts! ""mention dedicated < 2min of 2hr debate to Qs about ways black America has been under attack"" #GOPDebate url",0,0.6421,0.3579,4904
80,RT mention The candidates don't have to attack mention Fox is doing it for them by stoping him from speaking. _Ua14_Uau #GOPDebateU_,0,0.6889,0.31110000000000004,1854
81,"RT mention I think Cruz and Trump need to band together and expose this set up job, and get rid of Bush and Rubio, _Ua14_Uau #GOPDebate  #GU_",0,0.6237,0.3763,2844
82,"#gopdebate Trump hates fat people? He should look in the mirror. Poor Chris Christe won't challenge him. Well, you know why. : (",0,0.6742,0.3258,3443
83,".mention
FOX/GOP Party's Hunger Games- Demagog Food-fighter mention
#GOPDebate #morningjoe url",0,0.6517,0.34830000000000005,4156
84,"RT mention From watching the #GOPDebates it seems to me like #BlackLivesDontMatter  Bashing PBO over his ""failed policies"" is more impoU_",0,1.0,0.0,2570
85,"RT mention Dear Gov Walker, you have nothing to brag about, you fucked your state of Wisconsin and you suck Koch... #BitchAssPoliU_",0,1.0,0.0,2315
86,"RT mention I'd really like to see how long each candidate was given to speak.  It didn't seem ""Fair & Balanced"" at all. _Ua14_Uau #GOPDebatU_",0,1.0,0.0,4031
87,"RT mention If Walker, Paul or Huckabee had to meet with Putin or command our armies they'd shit their pants. Not president material. U_",0,1.0,0.0,576
88,#gopdebate Made for great TV. If I was a Repub I'd want Kasich/Rubio (or Fiorina) but I'm not so I don't.,0,0.6824,0.3176,543
89,"RT mention ""The purpose of the military is to kill people and break things""-Mike Huckabee #GOPDebates #KKKorGOP",0,0.6552,0.3448,2593
90,Sorry mention I was not offended by mention ! As a woman I was offended by mention !!! #GOPDebates #KellyFile,0,0.6396,0.3604000000000001,1417
91,RT mention #BATsAsk #GopDebate why does Walker believe busting unions is the same as fighting terrorism? mention,0,0.6363,0.3637,2456
92,LOL #bencarson #GOPDebates but seriously you didn't answer the question,0,0.6237,0.3763,1665
93,"RT mention Wham, Bam, Thank You, Ann! How the participants of the #GOPDebates should be seen. #truthbomb url",0,0.6914,0.3086,1019
94,"RT mention Cancel the primaries. Fox Party set up & anointed their man Jeb Bush
#GOPDebates #CantTrustABush #morningjoe url",0,1.0,0.0,1719
95,Donald Trump's toupee got me feenin for some cotton candy. Mmmm yum. #GOPDebates,0,0.6831,0.3169,1438
96,RT mention Not a single question in last night's #GOPDebate about the most urgent issue of our time: climate change.,0,1.0,0.0,4587
97,RT mention Why doesn't Chris Wallace ask the other politicans about their finances and where their money comes from? _Ua14_Uau #GOPDebate  U_,0,1.0,0.0,5696
98,#Bernie Sanders on #GOPDebate: What About Women? url #FeelTheBern,0,0.7065,0.2935,2443
99,A big problem facing Democrats will be how to get Hillary sober long enough for her to debate? #toot #GOPDebates,0,1.0,0.0,2329
100,RT mention trump is a turd #gopdebate,0,1.0,0.0,5890
101,"RT mention Well, #DonalTrump don't like the truth from the Fox Focus group conducted by #FrankLuntz url #GOPDeU_",0,0.6829,0.31710000000000005,5558
102,RT mention The candidates don't have to attack mention Fox is doing it for them by stoping him from speaking. _Ua14_Uau #GOPDebateU_,0,1.0,0.0,6161
103,"c'mon, megyn, let's get to the issues: jade helm, fluoride, ""trayvon riots,"" fema camps, freemasonry, the trilateral commission #GOPDebates",0,0.6489,0.3511,2966
104,RT mention After mention hugged Obama he doesn't deserve to be on the stage tonight. _Ua14_Uau #GOPDebates  #GOPDebates,0,1.0,0.0,1931
105,RT mention Fox is cherry picking the candidates. Jeb gets the softball questions. _Ua14_Uau #GOPDebates  #GOPDebates,0,0.6735,0.3265,749
106,mention Why did you lie about your US Attorney Start/Appointment date during #GOPDebate? Too easy to fact check..,0,0.6744,0.3256,1126
107,"RT mention ""Pimps are prostitues"" I now have to chug all my wine didn't think that was gonna make it in #GOPDebates",0,1.0,0.0,1315
108,"RT mention Can someone tell the GOP it's not ""I-ran"".... #GOPDebate",0,0.6667,0.33330000000000004,3369
109,#FoxNews should let someone else handle future debates. They are incompetent. #FoxDebate #GOPDebate,0,1.0,0.0,1468
110,"RT mention Jindal: if you wanna come here, do it legally, learn English, roll up your sleeves and get to work.
#GOPDebate",0,0.6418,0.3582,3199
111,RT mention Jeb Bush reminds me of elevator music. You hear it but you don't listen. _Ua14_Uau #GOPDebate  #GOPDebates,0,1.0,0.0,3086
112,Dumbo is on stage. *these views do not reflect the views of Walt Disney. Mostly because they're not racist enough #GOPDebates #RubiosEars,0,1.0,0.0,6002
113,How embarrassing. The whole world is watching this and they must be asking what is going on. #GOPDebates #Republicandebaters #Bernie2016,0,1.0,0.0,3089
114,GOP respects life....just not black ones. #GOPDebates,0,1.0,0.0,1725
115,RT mention $40 for a blowjob...plus tax. #GOPDebates,0,0.6722,0.3278,414
116,"Hey #GopDebates, Ronald Reagan has no relationship to you assholes, he pardoned millions of mexican americans #BOOM",0,0.6477,0.35229999999999995,3601
117,"Am I the only one that feels like I have a hangover but wasn't drunk last night? _U_
#GOPDebate",0,1.0,0.0,3030
118,"mention going.Ronda Rousey on mention 's  posterior and his childish comeback was a ""where were you when?"" moment.#GOPDebate",0,0.6813,0.3187,2708
119,"Wow apparently Trump got even more whiny and defensive after the debate. No class. Big mouth. Yeah, great presidential material. #GOPDebate",0,0.6136,0.3864,3716
120,RT mention Jeb Bush reminds me of elevator music. You hear it but you don't listen. _Ua14_Uau #GOPDebate  #GOPDebates,0,1.0,0.0,232
121,"RT mention Women should start protesting #GOPDebates misogyny with ""Stay out of my vagina unless I want you in there!"" placards. (I U_",0,1.0,0.0,4685
122,RT mention It was unfathomable that mention would ask Wasserman-Schultz to do a postmortem on the #GOPDebates. #SURREAL url,0,1.0,0.0,225
123,RT mention My feelings about Trump after #GOPDebate: url,0,1.0,0.0,784
124,"RT mention ""The purpose of the military is to kill people and break things""-Mike Huckabee #GOPDebates #KKKorGOP",0,0.6629999999999999,0.3370000000000001,2617
125,RT mention Jeb Bush reminds me of elevator music. You hear it but you don't listen. _Ua14_Uau #GOPDebate  #GOPDebates,0,1.0,0.0,447
126,That #GOPDebate last night was ridiculously biased against mention the moderators were very unprofessional.,0,0.6593,0.3407,2754
127,#RealityCheck: Rupert Murdoch & Valerie Jarrett gushing over Jeb Bush (& each other) #2016election #GOPDebate url,0,0.6742,0.3258,1335
128,Because GOP is on the WRONG side of all those issues. #GOPDebates #FoxNews #FoxDebate  url,0,0.6774,0.3226,1514
129,RT mention Fox is cherry picking the candidates. Jeb gets the softball questions. _Ua14_Uau #GOPDebates  #GOPDebates,0,1.0,0.0,5658
130,#GOPDebates on Fox. Where else? The Sloth Network?,0,0.6966,0.3034,2250
131,RT mention Has democracy ever been more for sale than w/ a GOP debate only accessible to those who pay for cable TV? #GOPDebate,0,0.6861,0.3139,210
132,".mention
Cancel the primaries. Fox Party set up & anointed their man Jeb Bush
#ObviousAsHell #GOPDebates #CantTrustABush #morningjoe",0,0.6737,0.32630000000000003,6164
133,"Not shocked much,but ""debate"" questions for both were ABSURD!!With all the shit we have going on, they chose 2 try & start fights #GOPDebate",0,1.0,0.0,812
134,RT mention The mention and mention are getting exactly what they deserve! #morningjoe #GOPDebate,0,1.0,0.0,1926
135,RT mention Can someone tell me why Ben Carson is carrying water for people who will barely let him speak? Racism much? #GOPDebates,0,1.0,0.0,3177
136,"Megyn - Did you call #Trump2016 names?
Bush - Not me!
Megyn - Ok! 

Seriously??? Crucify him like you do Trump!
#GOPDebates #Biased",0,0.6506,0.34940000000000004,1604
137,"RT mention It is very disappointing that Fox News is not conducting a ""Fair & Balanced"" Debate. _Ua14_Uau #GOPDebate  #GOPDebates",0,0.6409999999999999,0.3590000000000001,3341
138,"RT mention Hey mention -- if you want to check out the Constitution, it's right here in Philly. I'll keep the bridge open for yU_",0,0.6404,0.35960000000000003,5608
139,"RT mention I'd really like to see how long each candidate was given to speak.  It didn't seem ""Fair & Balanced"" at all. _Ua14_Uau #GOPDebatU_",0,0.6364,0.3636,4281
140,But the sound bite Rush Limbaugh played was mention on Hillary Clinton. #GOPDebate  Carly: Democrat party is undermining US fabric.,0,0.6503,0.3497,2277
141,"These people specialize in superlatives and hyperbole. Makes for good TV, but bad politics. #GOPDebates",0,1.0,0.0,2546
142,RT mention Walker: God is cutting the UW budget. Talk to him. #GOPdebates,0,0.7197,0.2803,5234
143,RT mention FOX News won't admit who the Republican leader is right now I mean mention only has a double-digit lead _Ua14_Uau #GOPDU_,0,1.0,0.0,4716
144,"RT mention Can we also compare and talk how many minority American citizens have died due to ""self-defense""? #GOPDebate",0,1.0,0.0,2489
145,"What I learned from the #GOPDebate:
Some guy's dad was a mailman. Jesus Christ is everyone's running mate. The GOP has run out of women.",0,1.0,0.0,3581
146,RT mention You take mention off the stage and last nightUas #GOPDebate is watched by next to no one.,0,1.0,0.0,2290
147,"RT mention Trump should have said, ""Megyn, ask these nine candidates, if they plan to support ME when I win the nomination.""
#GOPDebatU_",0,0.6705,0.3295,5488
148,mention Pandering & propaganda was alive & well during the #GOPDebate everyone running to the right of the other-catering 2the #KochBrothers,0,0.6596,0.34040000000000004,1286
149,"Not everyone is a fucking LGBT student struggling to pay bills Debs. 
#GOPDebate  url",0,1.0,0.0,2037
150,"mention No Guy. Trump shoots the messenger, as he did with Meagan Kelly last night. Must be a habitual response of his. #GOPDebate",0,0.66,0.34,6170
151,Wasted opportunity to ask a doctor what science is #DebateWithBernie #GOPDebacle #GOPDebates,0,1.0,0.0,5547
152,"RT mention #Perry, #Fiorina clips on #IranDeal are better than most answers being given in this debate #GOPDebates",0,0.6222,0.3778,1463
153,RT mention Why doesn't Chris Wallace ask the other politicans about their finances and where their money comes from? _Ua14_Uau #GOPDebate  U_,0,0.6867,0.3133,5255
154,RT mention 37% of the time during the #GOPDebate was the commentators questions & digs at mention Terrible 1st debate hosted bU_,0,1.0,0.0,2310
155,"mention ""our skin does not make us who we are.. It's our brain""... How is that a sellout? #GOPDebate",0,0.6774,0.3226,5878
156,mention they all need coif reform. #GOPDebates,0,0.6742,0.3258,179
157,mention yep mention sucked at #GOPDebate  mention  country is in a mess & debate questions Terrible,0,0.6667,0.33330000000000004,9
158,Shut the fuck up Rubio you ain't gonna win #GOPDebate,0,1.0,0.0,3903
159,RT mention Did I hear that right? #DonaldTrump had to pay people to attend a family wedding? #GOPDebates,0,0.6966,0.3034,4588
160,RT mention Has any candidate received a word from God?! Presidential hopefuls?! This is America?! Christian Brotherhood of America #U_,0,0.6889,0.31110000000000004,175
161,RT mention mention mention mention One interesting thing to note at #GOPDebate no questions were asked about NatiU_,0,0.6705,0.3295,2457
162,RT mention Fake laughter is the best laughter. #GOPDebate,0,1.0,0.0,5152
163,mention mention That's too extreme and violates the First Amendment #GOPDebate,0,0.6859999999999999,0.3140000000000001,1210
164,"These self righteous hypocrites, trying to out God each other. Shameless. #GOPDebates",0,1.0,0.0,116
165,RT mention It's cute how Chris Christie has the Bob's Big Boy haircut #GOPDebates,0,0.6725,0.3275,5381
166,RT mention #GOPDebates  I'd like to see this bunch of losers work a construction until they're 70 years old.  #Delusional,0,0.6495,0.35050000000000003,4279
167,#GOPDebate madness last night. DNC this morning.... #Guuuuurrrrlllll url,0,0.6632,0.3368,660
168,"""I think Trump looks very unserious ""... Ya think?? #CNN #GOPDebates",0,1.0,0.0,5155
169,RT mention So mention posed for adult pictures.should we bring that up? #GOPDebate  #GOPDebates,0,0.7097,0.2903,5736
170,Media sticks up 4 mention during #GOPDebate n rips #Trump. What media'is missing #Trump did not crash n burn. Megan set Trump up.,0,1.0,0.0,919
171,"RT mention #GOPDebate I used to be a fan of mention , not anymore.  She is laughing while attacking candidates. #UnprofessionalU_",0,1.0,0.0,743
172,"Last night, I wasn't sure if I was watching the #GOPDebate or an mention sketch. Absolutely hilarious.",0,1.0,0.0,3659
173,"RT mention This literally couldn't be more true for me. ""I Watched the #GOPDebate & All I Got Was a Lousy Hangover"" url",0,1.0,0.0,1420
174,"RT mention I think Cruz and Trump need to band together and expose this set up job, and get rid of Bush and Rubio, _Ua14_Uau #GOPDebate  #GU_",0,0.6966,0.3034,4110
175,"RT mention If mention hasn't wrapped up the mailman vote by the end of this debate, he ought to drop out. #GOPdebates #LZDebates",0,0.688,0.3120000000000001,3171
176,"RT mention mention 
A rare view from behind the stage at the #GOPDebate  A behind the scene look at candidates.. #GOPDEBATES url",0,0.6703,0.3297,5717
177,"RT mention Paul brilliantly got Christie to admit that he would violate the 4th Amendment. Of course, no one in that building cares. #U_",0,0.6966,0.3034,2882
178,RT mention time-lapse of my face during the entire #GOPDebate url,0,0.6782,0.3218,5355
179,The #GOPDebate was a bunch of fake tanned idiots say opinions no one cared for. It was basically the mention  mention,0,1.0,0.0,6090
180,RT mention Aaaand #megynfail brings in DNC chair to take down Trump thru women's rights. My gender once again used as fear tool. Ugh #GOU_,0,1.0,0.0,2681
181,"RT mention Scott Walker keeps saying he turned Wisconsin around. That state is poor, poverty stricken and riddled with bullets. #GOPDU_",0,1.0,0.0,2707
182,RT mention We the American people pick the next President of United States not FOX News _Ua14_Uau #GOPDebate  #GOPDebates,0,1.0,0.0,4683
183,"RT mention As president, I will get tough on China. As soon as I've accepted delivery of my next shipload of shirts #GOPDebate htU_",0,0.6585,0.3415,4765
184,RT mention The biggest losers in the debate were the Fox moderators who attacked instead of moderating #GOPDebate,0,1.0,0.0,3748
185,All the tweets about the #GOPDebate are hilarious _UOI_UE (aka Trump is the biggest joke of 2015; thanks for all the laughs _Ua),0,1.0,0.0,1899
186,RT mention Chrissy 'Tingles' Matthews gets his ass handed to him by Carly Fiorina. _Ua_Ua_Ua url #GOPDebate,0,0.6838,0.31620000000000004,1839
187,"No, Rand Paul does not have a budget, he has budgets... multiple sets of books? Yep... #GopDebates",0,1.0,0.0,2302
188,RT mention Am I the only one who doesn't trust mention #RandPaul #GOP2016 #GOPDebate #GOPDebates #USA #Merica,0,1.0,0.0,3397
189,"Hey Rand, say negotiate one more time #GOPDebates",0,0.6477,0.35229999999999995,6070
190,mention wins the polls in the #GOPDebate debate. What does that tell u? #Americans r sick of the same ole politician song & dance.,0,1.0,0.0,6178
