,text,crowd_label,conf0,conf1,itemID
1530,UImention The #GOPDebate got my man Ben Carson out there like: url,1,0.0,1.0,1928
1531,RT mention A 16.0 overnight rating for the #GOPDebate? That's a huge viewership if that holds. url,1,0.3813,0.6187,1937
1532,RT mention mention hits it out of park on mention gotcha question on campaign donations. #GOPDebates,1,0.3411,0.6589,1939
1533,RT mention FOX News won't admit who the Republican leader is right now I mean mention only has a double-digit lead _Ua14_Uau #GOPDU_,1,0.32609999999999995,0.6739,1944
1534,RT mention Marco Rubio emerges as the partyUas brightest star url #GOPDebate #Rubio2016 #ImwithMarco,1,0.0,1.0,1949
1535,Ted Cruz appears to be the oddan put so far. More Ted please #FoxNews #GOPDebates,1,0.3297,0.6703,1954
1536,mention came out of the gate like a true leader. I look forward to hearing more about his plans for a better America. #GOPDebate,1,0.0,1.0,1962
1537,RT mention I will make no apologies for protecting the lives and the safety of the American people. #GOPDebate url,1,0.3218,0.6782,1963
1538,RT mention Enjoyed the #GOPDebates and am looking forward to the #DemocraticDebates next.,1,0.0,1.0,1966
1539,"RT mention mention says mention topped candidates in new Twitter followers after #GOPDebates. 24000 vs. 2nd place, 11000 mention",1,0.34830000000000005,0.6517,1967
1540,"RT mention I'm about as Bernie Sanders as they come, but my god, HOW is Marco Rubio not ahead of his race by 40+ points? #GOPDebates",1,0.3908,0.6092,1971
1541,mention #GOPDebates Our president should be less like #TedCruz,1,0.33830000000000005,0.6617,1972
1542,"RT mention As of 10:15, Carson and Rubio are definitely my front-runners #GOPDebate",1,0.0,1.0,1975
1543,RT mention Biggest winner of tonight's #GOPDebate was far and away Hillary Clinton.,1,0.3684,0.6316,1976
1544,mention failed mention appeared follish and mention ROCKED the HOUSE!#GOPDebate  url,1,0.31110000000000004,0.6889,1980
1545,RT mention Just wanted to say good luck to all the #GOPDebate candidates taking the stage shortly for the First Debate at 5:00PM.,1,0.3407,0.6593,1983
1546,"RT mention I think Cruz and Trump need to band together and expose this set up job, and get rid of Bush and Rubio, _Ua14_Uau #GOPDebate  #GU_",1,0.3488,0.6512,1985
1547,"I rarely say it: Props 2 mention for asking tough Qs at #GOPdebate. W/ their ""special"" link to conservatives, only they could - & they did",1,0.32220000000000004,0.6778,1988
1548,RT mention Ask Trump a legitimate question. Look at Wallace's face when Trump nails it. _Ua14_Uau #GOPDebate  #GOPDebates,1,0.0,1.0,1991
1549,mention is fact checking last night's #GOPDebate. This is awesome.,1,0.0,1.0,2006
1550,"RT mention #TedCruz headed into the Presidential Debates. GO TED!! 

#GOPDebates url",1,0.0,1.0,2008
1551,RT mention The NY Times say Rand Paul matters again! #StandwithRand #Liberty #GOPDebate #tcot #tlot url,1,0.3118,0.6882,2018
1552,The clear winners in #GOPDebate were mention and mention and that is a powerful combo I could support.,1,0.0,1.0,2027
1553,RT mention Cruz's line about #CampaignConservative cuts 2 the core of the issue with GOP & also the shortcomings of #GOPDebate httU_,1,0.31110000000000004,0.6889,2036
1554,"RT mention In terms of substance, mention dominates #GOPdebates",1,0.0,1.0,2040
1555,RT mention Ask Trump a legitimate question. Look at Wallace's face when Trump nails it. _Ua14_Uau #GOPDebate  #GOPDebates,1,0.32630000000000003,0.6737,2049
1556,mention Was fantastic in the debate.  On to the White House!  #imwithhuck #GOPDebate #th16 url,1,0.3487,0.6513,2050
1557,"RT mention Trump should have said, ""Megyn, ask these nine candidates, if they plan to support ME when I win the nomination.""
#GOPDebatU_",1,0.3369,0.6631,2071
1558,"To me, the real winner of last night #GOPDebate was mention #MegynKelly",1,0.0,1.0,2072
1559,"The best answers from yesterday, in substance and style, came from mention bar none. #GOPDebate #Outnumbered",1,0.3103,0.6897,2078
1560,#Winning #CruzCrew _U_ Keep It Up! #TedCruz2016 #GOPDebate  url,1,0.3226,0.6774,2089
1561,"mention treated mention like the little gnat he is. 
#GOPDebate #tcot #trump #MakeAmericaGreatAgain #GoTrump",1,0.0,1.0,2090
1562,Great job mention on the #GOPDebate !  I enjoyed listening to u!,1,0.0,1.0,2092
1563,mention GREAT JOB #GOPDebate,1,0.0,1.0,2102
1564,RT mention It's quite entertaining to read other countries' headlines of #GOPDebate vs American ones. The sensibility elsewhere givU_,1,0.35700000000000004,0.643,2110
1565,"""Freedom is not free and we must fight for it every day.""  -mention Even if you don't vote for the guy, appreciate #truth #GOPDebate",1,0.0,1.0,2112
1566,mention stopping by to talk with mention today. Tune in @ noon to hear what he has to say about #GOPDebate url,1,0.35050000000000003,0.6495,2114
1567,"Looks like mention & mention were the big winners of the #GOPDebate, and I agree! url",1,0.3682,0.6318,2117
1568,"RT mention Trump has got it right, nobody would talk about immigration, not untill be brought it up. #GOPDebate #GOPDebates",1,0.3370000000000001,0.6629999999999999,2121
1569,If I had to vote Republican (God forbid) #JohnKasich would have my vote. #RepublicanDebate #FoxNews #GOPdebates,1,0.0,1.0,2122
1570,The reason mention did not take that pledge at #GOPDebate is exactly because he is a good negotiator.,1,0.33330000000000004,0.6667,2127
1571,"RT mention John Kasich got a louder applause from the Q arena in Cleveland than LeBron James.

#GOPDebate",1,0.3811,0.6189,2128
1572,RT mention This is Men's Warehouse's biggest night. #GOPDebate #ClownCarDumpsterFire,1,0.3372000000000001,0.6628,2130
1573,I want to RT all of mention #GOPDebate tweets. There is nothing better on this Friday.,1,0.2955,0.7045,2139
1574,"RT mention #TedCruz As President, I will always tell the truth, and do what I said I would do.  #GOPDebates",1,0.3146,0.6854,2140
1575,RT mention You would never know mention  is the frontrunner from watching this debate. _Ua14_Uau #GOPDebate  #GOPDebates,1,0.34830000000000005,0.6517,2141
1576,RT mention Ask Trump a legitimate question. Look at Wallace's face when Trump nails it. _Ua14_Uau #GOPDebate  #GOPDebates,1,0.3249,0.6751,2143
1577,"I nominate mention for the ""Best Comedy Special"" Emmy in 2015; their parody of a political debate was outstanding.  #GOPDebate #GOP2016",1,0.34830000000000005,0.6517,2150
1578,Many good men in 2nd GOP debates #GOPDebate #GOPDebates,1,0.0,1.0,2163
1579,"RT mention #TedCruz headed into the Presidential Debates. GO TED!! 

#GOPDebates url",1,0.0,1.0,2164
1580,"RT mention Thanks Fox News, you're raising mention 's ratings. _Ua14_Uau #GOPDebate  #GOPDebates",1,0.3501,0.6499,2165
1581,Republicans are turning on Fox News and it is AWESOME!!!! #GOPDebate,1,0.0,1.0,2178
1582,"RT mention I think Cruz and Trump need to band together and expose this set up job, and get rid of Bush and Rubio, _Ua14_Uau #GOPDebate  #GU_",1,0.31520000000000004,0.6848,2181
1583,"mention LOL sham focus group, a bunch of Bush/RNC plants! #Trump2016 won #GOPDebate hands down!",1,0.3187,0.6813,2184
1584,mention mention mention mention #RNC mention -> WE raised OUR hands too! #GOPDebate mention #MakeAmericaGreatAgain #NoAmnesty,1,0.3226,0.6774,2185
1585,Yassssss #DonaldTrump is doing it up... He answers the questions the way he wants to. #FOXNEWSDEBATE #GopDebates,1,0.32410000000000005,0.6759,2191
1586,RT mention bless u for this rand paul #GOPdebate,1,0.0,1.0,2194
1587,"Even the media doesn't get it,  No one won last night's #GOPDebate.  ALL the men further alienated their base.  Carly was the only star.",1,0.32609999999999995,0.6739,2204
1588,RT mention #GOPDebate Loving Fiorina. Smart and on point!,1,0.0,1.0,2225
1589,"RT mention #TedCruz As President, I will always tell the truth, and do what I said I would do.  #GOPDebates",1,0.1949,0.8051,2229
1590,RT mention mention mention impressive #GOPDebate,1,0.3723,0.6277,2233
1591,"RT mention Three best performance in the #GOPDebates (in no order), IMHO:  Carly Fiorina & Ben Carson & Marco Rubio.",1,0.3516,0.6484,2236
1592,RT mention Ask Trump a legitimate question. Look at Wallace's face when Trump nails it. _Ua14_Uau #GOPDebate  #GOPDebates,1,0.3103,0.6897,2240
1593,"mention Of course. It'd be cool to see which users ranked highest for #GOPDebate tweets, too. After all, we're the tweeters.",1,0.34700000000000003,0.653,2253
1594,"RT mention Thanks Fox News, you're raising mention 's ratings. _Ua14_Uau #GOPDebate  #GOPDebates",1,0.0,1.0,2259
1595,#Trump is killing me in the #GOPDebates. Loved his #AtlanticCity zinger to #ChrisChristie. And how condescending he was to the moderator.,1,0.32709999999999995,0.6729,2272
1596,RT mention I just love mention She owned last night _UaI_U__Ua14_Uau_U #GOPDebate #ycot url,1,0.0,1.0,2275
1597,He has the record and experience! #ExperienceMatters! .mention IUam Ready To Be POTUS: url #Perry2016 #GOPDebate,1,0.33609999999999995,0.6639,2278
1598,"If I had to vote today, it would be mention #GOPDebate #leader #dominated I saw a CEO of the panel. #CEO of the #Country.",1,0.0,1.0,2279
1599,mention and mention 2016 #C2 #Csquared America can be great again! mention #GOPDebates,1,0.0,1.0,2283
1600,Just had a great time taping mention for Power&Politics. Had fun with mention talking about #GOPDebate. Thanks mention Watch it,1,0.0,1.0,2284
1601,"Jeb is a swell guy, and Donald is gruff. I'm a Marco Rubio fan #GOPDebates",1,0.2874,0.7126,2292
1602,WHAT IS LOVE? Presenting D Trump at the Roxbury! url #DonaldTrump #GOPDebate url,1,0.0,1.0,2294
1603,"RT mention Thanks Fox News, you're raising mention 's ratings. _Ua14_Uau #GOPDebate  #GOPDebates",1,0.0,1.0,2301
1604,RT mention Didn't catch the full #GOPdebate last night. Here are some of Scott's best lines in 90 seconds. #Walker16 url,1,0.3667,0.6333,2316
1605,RT mention Donald the real RINO in the race. But he doesnUat mean it. url #GOPDebate,1,0.3214,0.6786,2322
1606,"Trump & co drew NBA Finals type viewership for #GOPdebate, MURICA wins again.",1,0.3146,0.6854,2331
1607,RT mention Enjoyed the #GOPDebates and am looking forward to the #DemocraticDebates next.,1,0.0,1.0,2333
1608,RT mention You would never know mention  is the frontrunner from watching this debate. _Ua14_Uau #GOPDebate  #GOPDebates,1,0.3085,0.6915,2336
1609,RT mention FOX News won't admit who the Republican leader is right now I mean mention only has a double-digit lead _Ua14_Uau #GOPDU_,1,0.3295,0.6705,2337
1610,RT mention #Rubio seems to be the only candidate actually saying HOW he's going to get things done #GOPDebate #Rubio2016,1,0.0,1.0,2345
1611,.mention named mention has one of his UIwinnersU of #GOPDebate UO-> url #ImWithHuck,1,0.0,1.0,2351
1612,One of my favorite things about the #GOPDebates is how many of these candidates I've seen in person. Thanks mention & mention,1,0.3420000000000001,0.6579999999999999,2352
1613,RT mention .mention said it best last night: It's time to #GetMoneyOut #GOPDebate #GOPTBT #KochVsPope url,1,0.3409,0.6591,2357
1614,Ben Carlson nailed it on his comments about race and our own country trying to divide us!!! mention #GOPDebate #GOPDebates,1,0.3017,0.6983,2363
1615,Rightly so Frank. Rightly so. #GOPDebate  url,1,0.3371,0.6629,2366
1616,"RT mention #TRUMP2016 #GOPDEBATES  Finally, someone saying...SCREW POLITICAL CORRECTNESS.  Sick of it, and looking to NEW leadershiU_",1,0.0,1.0,2377
1617,So after the #GOPDebate last night I think I know who I want to be president. #MegynKelly #MegynKellyforPresident #MegynKelly2016,1,0.0,1.0,2379
1618,RT mention Enjoyed the #GOPDebates and am looking forward to the #DemocraticDebates next.,1,0.2935,0.7065,2381
1619,RT mention Enjoyed the #GOPDebates and am looking forward to the #DemocraticDebates next.,1,0.0,1.0,2383
1620,RT mention That's right mention Call Terrorists what they are! Islamic! You can't beat enemy if you don't identify who they are! #GOPDeU_,1,0.33330000000000004,0.6667,2391
1621,Donald Trump's  best lines from the first GOP debate   #Debates #GOPDebates #DonaldTrump url,1,0.30789999999999995,0.6921,2405
1622,"RT mention Regardless of who we all vote for, let's be honest: Dr. Carson has had the most meaningful life of these people. God bleU_",1,0.0,1.0,2409
1623,RT mention mention Rand Paul cares more about upholding and applying the constitution than any of the other candidates. #GOPDebate #U_,1,0.0,1.0,2410
1624,RT mention Ask Trump a legitimate question. Look at Wallace's face when Trump nails it. _Ua14_Uau #GOPDebate  #GOPDebates,1,0.32220000000000004,0.6778,2413
1625,RT mention Prediction: Donald Trump goes up in post debate polls. Because he looks no crazier than anyone else and more entertaining #U_,1,0.31410000000000005,0.6859,2414
1626,RT mention A good debate is when you don't even notice the moderators. mention #GOPDebate,1,0.0,1.0,2416
1627,RT mention #ImWithHuck #GOPDebate #DNA defines a person. 5th & 14th Amendments guarantee a person the #RightToLife #DontBackDown url,1,0.33919999999999995,0.6608,2418
1628,mention Good for you! #gopdebates #gaymarriage #equality,1,0.0,1.0,2423
1629,Reguardless of your political stances I hope you took time to see the #GOPDebate I LOVE seeing genuine interest in U.S. politics.,1,0.0,1.0,2425
1630,"RT mention Thanks Fox News, you're raising mention 's ratings. _Ua14_Uau #GOPDebate  #GOPDebates",1,0.34440000000000004,0.6556,2428
1631,RT mention FOX #GOPDebate drew 10 million viewers. No Democrat primary debate has ever attracted anything like this...-- Rush,1,0.361,0.639,2430
1632,Some would see it as radical but I liked mention idea of using 5th and 14th amendments to stop abortion #GOPDebate,1,0.0,1.0,2433
1633,RT mention The happiest person in America today after watching those debates is HRC. #GOPDebates.,1,0.3258,0.6742,2438
1634,RT mention It's one thing 2 recognize a WINNER but America recognizes one who can help AMERICA win! #Rick2016 #GOPDebate #TCOT htU_,1,0.0,1.0,2442
1635,RT mention I loved Scott Walker as Mark Harmon's romantic rival in SUMMER SCHOOL. Look it up. #GOPDebate,1,0.0,1.0,2446
1636,After watching the #GOPdebates I've made my decision! I'm voting for mention OMG! Where has she been all my life ? She is so HOT,1,0.3371,0.6629,2462
1637,RT mention #GOP2016debate #GOPDebate #GOPDebates #Trump2016 #Trump2016 Trump has the GOP scared.  They don't control him.  He talks aboU_,1,0.32430000000000003,0.6757,2466
1638,"RT mention 'God has blessed the Rep party with a lot of great candidates, the Dem party cannot even find one"" mention #GOPDebU_",1,0.0,1.0,2469
1639,Enjoyed the #GOPDebates and am looking forward to the #DemocraticDebates next. url j8p,1,0.3436,0.6564,2476
1640,RT mention _Ua_Ua_Ua_Ua Drink!!! #Trump #GOPDebates  url,1,0.3372000000000001,0.6628,2479
1641,After the #GOPDebate all of the promises being made by startups at this tech conference seem quite reasonable.,1,0.0,1.0,2482
1642,mention #GOPDebates spot on!,1,0.3256,0.6744,2490
1643,"RT mention Ben Carson, solidifying the black vote. #GOPDebates",1,0.3289,0.6711,2495
1644,"I know I'm tweeting too much, but I'm just tryna to get a forced invite to Trump's next wedding. #GOPDebates #GOPteen",1,0.3164,0.6836,2509
1645,RT mention One of my favorite things about the #GOPDebates is how many of these candidates I've seen in person. Thanks mention & U_,1,0.3478,0.6522,2513
1646,mention is a treat for us all to enjoy. #GOPDebate,1,0.0,1.0,2514
1647,LMFAO!! I'm drunk but I enjoyed that! #Trump #GOPDebates  url,1,0.0,1.0,2515
1648,He won in my book as well! #ImWithHuck #GOPDebate #th2016 #ccot #tcot #teaparty #pjnet url,1,0.0,1.0,2518
1649,"RT mention #GOPDebate Rand Paul was given the least amount of talk time, yet he said the most. #StandWithRand I LOVED him smashing ChristU_",1,0.0,1.0,2521
1650,"RT mention My girl mention killed it. She's presidential, wildly intelligent, experienced, sharp, practical, strategic & strongU_",1,0.33020000000000005,0.6698,2522
1651,#GOPDebate Econ mention won mention falters mention exaggerates mention Good idea #SocialSecurity url,1,0.3077,0.6923,2524
1652,America is a miracle country. _Ua14_Uau. #GOPDebates,1,0.0,1.0,2528
1653,"RT mention Dr. Carson remark on DC having half a brain, best line #GOPDebates.",1,0.3194,0.6806,2533
1654,#ChrisChristie and #CarlyFiorina what a team they'd make! #GOPDebate #Election2016,1,0.3297,0.6703,2537
1655,Great images. #GOPDebate #photography url,1,0.0,1.0,2549
1656,mention Agree. Carson was very compelling when given the chance. #GOPDebate,1,0.0,1.0,2557
1657,RT mention mention Headed out to the #GOPDebates in Cleveland should be interesting #MotleyCrue,1,0.32520000000000004,0.6748,2559
1658,Excited to see how my personal favorites will continue to do after last night! mention mention and mention #GOPDebate #2016,1,0.0,1.0,2561
1659,UIThis country owes 19 trillion dollars and we need someone like me to fix this messU UO Donald Trump #GOPDebates,1,0.3371,0.6629,2564
1660,"RT mention I think Cruz and Trump need to band together and expose this set up job, and get rid of Bush and Rubio, _Ua14_Uau #GOPDebate  #GU_",1,0.0,1.0,2571
1661,"RT mention Thanks Fox News, you're raising mention 's ratings. _Ua14_Uau #GOPDebate  #GOPDebates",1,0.3184,0.6816,2573
1662,"RT mention #TedCruz headed into the Presidential Debates. GO TED!! 

#GOPDebates url",1,0.0,1.0,2579
1663,"RT mention Cruz had a great night.
#hannity #GOPDebate",1,0.0,1.0,2587
1664,mention mention Best Statement of the night Dr Carson! Thank you 4 putting it n2 perspective 4 the ignorant n the world #GOPDebates,1,0.0,1.0,2601
1665,Passion of the #GOPDebate #ReligiousUpaMovie,1,0.3448,0.6552,2602
1666,mention rope-a-dope strategy for #GOPDebate was brilliant.,1,0.0,1.0,2604
1667,"RT mention Thanks Fox News, you're raising mention 's ratings. _Ua14_Uau #GOPDebate  #GOPDebates",1,0.0,1.0,2618
1668,I like Ted Cruz because he looks like Bill Murray. #gopdebates,1,0.3671,0.6329,2625
1669,"It's brilliant that Trump never apologizes for anything he says. I mean everyone loves a bully, right? #dumptrump #GOPDebate",1,0.35740000000000005,0.6426,2631
1670,#GOPDebate #GOPDebates Carly Fiorina won 1st round Marco Rubio led 2nd round,1,0.35050000000000003,0.6495,2637
1671,RT mention mention I want a #trump for president shirt!!! #GOPDebate,1,0.0,1.0,2639
1672,"RT mention Trump should have said, ""Megyn, ask these nine candidates, if they plan to support ME when I win the nomination.""
#GOPDebatU_",1,0.3667,0.6333,2648
1673,"Chris Christie did nicely, I think. I'm surprised Fox News didn't hit him with ""fat"" questions though. #fitnessaspresident #GOPDebate",1,0.3370000000000001,0.6629999999999999,2649
1674,mention #MakeAmericaGreatAgain #GOPDebate #TrumpForPresident  I put this together for you. url via mention,1,0.0,1.0,2669
1675,"Retweeted Donnie Wahlberg (mention

Enjoyed the #GOPDebates and am looking forward to the #DemocraticDebates next.",1,0.3386,0.6614,2670
1676,RT mention Rubio wins. #GOPDebate,1,0.3846000000000001,0.6154,2673
1677,RT mention I loved it in the #GOPdebate when mention said the country needs him to straighten out the financial mess.,1,0.0,1.0,2674
1678,"RT mention Thanks Fox News, you're raising mention 's ratings. _Ua14_Uau #GOPDebate  #GOPDebates",1,0.3187,0.6813,2683
1679,"Watched #GOPDebates; loved #BenCarson closing statement. ""#Trump is affectionate mad man while Carson is affectionate person who cares.""_Ua14_Uau",1,0.0,1.0,2697
1680,mention I'm just hoping I have an opportunity to vote for mention by the time the CA primary cones around. #GOPDebate #Carly2016,1,0.0,1.0,2702
1681,RT mention mention Headed out to the #GOPDebates in Cleveland should be interesting #MotleyCrue,1,0.33330000000000004,0.6667,2711
1682,I am not the biggest mention fan in the world. (Or Fox in general) but I really enjoyed her question to Trump about women #GOPDebate,1,0.31110000000000004,0.6889,2713
1683,"RT mention I think Cruz and Trump need to band together and expose this set up job, and get rid of Bush and Rubio, _Ua14_Uau #GOPDebate  #GU_",1,0.0,1.0,2718
1684,I like what Marco Rubio had to say at the beginning actually. #GOPdebate,1,0.0,1.0,2721
1685,Rubio had the Best Attack of the night was from Marco Rubio on Hillary Clinton ... #TCOT #ccot #PJNET #gop #GOPDebates,1,0.0,1.0,2731
1686,RT mention You would never know mention  is the frontrunner from watching this debate. _Ua14_Uau #GOPDebate  #GOPDebates,1,0.2921,0.7079,2733
1687,"NYTimes: UIIt compels me to write a cluster of words I never imagined writing: hooray for Fox News.U #GOPdebate 
url",1,0.33330000000000004,0.6667,2735
1688,RT mention #TeamMarco - understands immigration better than anyone on stage. #GOPDebate url,1,0.0,1.0,2737
1689,"RT mention Jeb Stands By ""Act of Love""; Comments and Earned Legal Status [BOO]
#NoAmnesty
url
#GOPDebates",1,0.33,0.67,2746
1690,"RT mention I think Cruz and Trump need to band together and expose this set up job, and get rid of Bush and Rubio, _Ua14_Uau #GOPDebate  #GU_",1,0.3370000000000001,0.6629999999999999,2755
1691,I just finished reading mention 's #GOPDEBATE tweets and still laughing until now. Very entertaining (:,1,0.3636,0.6364,2756
1692,"Cruz, go and take down other EOs in previous administrations that were illegal! #GOPDebates",1,0.3258,0.6742,2759
1693,"RT mention #TedCruz As President, I will always tell the truth, and do what I said I would do.  #GOPDebates",1,0.3325,0.6675,2764
1694,"RT mention #TedCruz headed into the Presidential Debates. GO TED!! 

#GOPDebates url",1,0.0,1.0,2766
1695,RT mention Good explanation as to why #Trump surges ahead of other #cuckservative candidates. #GOPDebate url url,1,0.0,1.0,2770
1696,#FOXNEWS  #GOPDebates  mention OWNS this Debate when it comes to SMART,1,0.3587,0.6413,2774
1697,RT mention Ask Trump a legitimate question. Look at Wallace's face when Trump nails it. _Ua14_Uau #GOPDebate  #GOPDebates,1,0.0,1.0,2777
1698,"#Fiorina is presidential material.  Looking forward to seeing her surge.
#GOPDebate",1,0.3158,0.6842,2786
1699,RT mention One of my favorite things about the #GOPDebates is how many of these candidates I've seen in person. Thanks mention & U_,1,0.3086,0.6914,2807
1700,#GOPDebate Trump trumped all Bush bushed Walker weak Huckabee/Cruz loonies-as-usual Carson insignificant Rand sucks Fiorina hysterical,1,0.3267,0.6733,2808
1701,mention gave the only intelligent answer on entitlements last night and he only got 65% of it right. #GOPDebate,1,0.0,1.0,2812
1702,What should you do the day after last night's #GOPDebate? Google mention,1,0.3226,0.6774,2824
1703,"mention mention Kim/Kanye are great examples of Hillary's ""useful idiots"" that mention was referring to in #GOPDebate .",1,0.32630000000000003,0.6737,2829
1704,My take away from last night's #GOPDebate: I love mention and I always will.,1,0.3487,0.6513,2839
1705,"mention mention Thanks, made the donation. Everyone needs to donate to Planned Parenthood after watching #GOPDebate!",1,0.3226,0.6774,2848
1706,"RT mention mention and mention need to take control of this debate,  they can do it, _Ua14_Uau #GOPDebate  #GOPDebates",1,0.0,1.0,2855
1707,".mention is breaking down the debate with fact checks, good to see the media actually holding some of the candidates accountable. #GOPDebate",1,0.3397,0.6603,2857
1708,"RT mention Ted #Cruz was the smartest, most articulate man on stage at #GOPDebate - Most Presidential. url",1,0.33330000000000004,0.6667,2881
1709,Huff Post is praising mention That should tell you something. #GOPDebates mention,1,0.3755,0.6245,2884
1710,"RT mention I'm imagining Trump giving a State of the Union, and yeah ok maybe I'd vote for him #GOPDebates",1,0.0,1.0,2885
1711,"RT mention If you watched the #GOPDebate last night, why not send $5 to mention this morning? url #ReproJustice #RU_",1,0.3613,0.6387,2892
1712,RT mention mention mention That was fear. They tried to shut mention out in the #GOPDebate but his message was heU_,1,0.3531,0.6469,2898
1713,Missing the #GOPDebates makes me glad I don't have cable. Missing #JonStewart last show makes me sad I don't have cable. #JonVoyage,1,0.3297,0.6703,2905
1714,"RT mention Thanks Fox News, you're raising mention 's ratings. _Ua14_Uau #GOPDebate  #GOPDebates",1,0.0,1.0,2914
1715,"Ted Cruz won that debate ""Imo"" 
#GOPDebate ""early numbers suggest record audience"" yea! people are watching",1,0.0,1.0,2917
1716,RT mention John Kasich is doing something bold- not pandering to the base.Wonder if he gets points for courage.Maybe gets respect for tU_,1,0.3216,0.6784,2932
1717,"WOW. The ratings for last night's #GOPDebate are jaw dropping. Nielsen says 16.0 nationwide, most watch debate ever.",1,0.3103,0.6897,2935
1718,"Debate Preformances:
Kasich A-
Rubio A-
Carson B+
Christie B+
Trump B
Bush B
Cruz B-
Huckabee B-
Paul C+
Walker C
#GOPDebate #Kasich #Rubio",1,0.33209999999999995,0.6679,2937
1719,Anybody watch the mention roast last night? He handled it pretty well. #GOPDebate #VoteTrump,1,0.0,1.0,2943
1720,"RT mention I think Cruz and Trump need to band together and expose this set up job, and get rid of Bush and Rubio, _Ua14_Uau #GOPDebate  #GU_",1,0.3158,0.6842,2944
1721,Ben Carson's got the best hair on that whole stage #GOPDebates,1,0.35629999999999995,0.6437,2958
1722,"RT mention Three best performance in the #GOPDebates (in no order), IMHO:  Carly Fiorina & Ben Carson & Marco Rubio.",1,0.3618,0.6382,2978
1723,"RT mention #TedCruz headed into the Presidential Debates. GO TED!! 

#GOPDebates url",1,0.0,1.0,2980
1724,RT mention Thank you Cruz!  Finally someone who pledges to reverse every Obama executive order day 1. Why is this so hard? #GOPDebU_,1,0.33,0.67,2982
1725,RT mention The candidates don't have to attack mention Fox is doing it for them by stoping him from speaking. _Ua14_Uau #GOPDebateU_,1,0.3287,0.6713,2989
1726,Great answer mention #GOPDebates,1,0.0,1.0,2998
1727,"RT mention I think Cruz and Trump need to band together and expose this set up job, and get rid of Bush and Rubio, _Ua14_Uau #GOPDebate  #GU_",1,0.32220000000000004,0.6778,3013
