text,crowd_label,conf0,conf1,itemID
Abe government said the missiles were not 'weapon' so JSDF could provide them to the ally when collective self defense right was exercised.,1,0.19820000000000004,0.8018,5525
New RAN report from the frontlines of human rights abuses and forest destruction for fashion.: url,1,0.3946,0.6054,5526
#360WiseNews : China's Stock Market Crash: Are There Gems In The Rubble? url,0,0.6042,0.3958,5527
HELP ME I'M SINKING,0,0.7992,0.2008,5528
Domestic terrorism. No ifs ands or buts about it. YOU CREATED THIS mention url,0,0.6006,0.3994,5529
"#LonePine remembered around Australia as 'descendants' grow via mention #Gallipoli #WW1
url url",0,1.0,0.0,5530
Ignition Knock (Detonation) Sensor-KNOCK SENSOR Delphi AS10012 url url,1,0.2,0.8,5531
Bo2 had by far the best competitive maps imo hope bo3 is the same #InVahnWeTrust,0,1.0,0.0,5532
#WorldWatchesFerguson #Florida mention mention How dare you turn our streets into a war zone -a war against CITIZENS?,1,0.2,0.8,5533
#SigAlert: North & Southbound 133 closed btwn 5 fwy and Irvine Blvd due to truck fire. CHP is detouring traffic.,1,0.1994,0.8006,5534
mention probably being inundated with this question now but who's coming to creamfields??? (please say all 3) #Mainstage,0,1.0,0.0,5535
#Sismo M 1.3 - 1km NNE of The Geysers California: Time2015-08-05 23:40:21 UTC2015-08-05 16:40:21 -07:00 a... url #CS,0,0.7992,0.2008,5536
NEMA Ekiti distributed relief materials to affected victims of Rain/Windstorm disaster at Ode-Ekiti in Gbonyin LGA.,1,0.0,1.0,5537
"What This Man Did To Save A Drowning Squirrel Is Absolutely Incredible
url url",0,0.8012,0.1988,5538
"Conditions for Paris FR at 4:00 am CEST: Current Conditions:
Fair 68 FForecast:
Thu - Sunny. High: 87 Low: 61
Fri - PM Thunderstorm...",0,0.7976,0.2024,5539
#onceaho Empire Girl: Vote Abella Danger: Adult Empire is running their first ever hunt for the Emp... url #alwaysaho,0,1.0,0.0,5540
Crushed the gym then crushed a butterfinger flurry clearly my priorities are straight ??,0,0.6006,0.3994,5541
"Aug 3 1915UOKILL 10000 WITH ROCKS.; Italians Make Good Use of Nature's Weapons -- Excel with Bayonet.
url",1,0.0,1.0,5542
#IDFire Parker Ridge Fact Sheet Aug 6 2015 (Parker Ridge Wildfire): Information Phone: 208-267-6773 Email: pa... url,1,0.2036,0.7964,5543
Only SHADOWMAN can save the Big Easy from a deluge of supernatural monstrosities... Read free: url url,0,0.6006,0.3994,5544
Hail The New Caesars! url url,0,1.0,0.0,5545
Storm damage maybe a tornado near Chadbourn. See url url,1,0.0,1.0,5546
Got my first damage today  fuckkkkkk,0,1.0,0.0,5547
The Catastrophic Effects of Hiroshima and Nagasaki Atomic Bombings Still Being Felt Today url,1,0.0,1.0,5548
UO bulletproof and black like a funeral; the world around us is burning but we're so cold. url,1,0.2036,0.7964,5549
Do babies actually get electrocuted from wall sockets? I'm wondering how I and those before me survived childhood.,1,0.1999,0.8001,5550
Created save #666 on my current Fallout 3 playthrough. Hail Satan!,0,1.0,0.0,5551
'When you attack PP you attack women's health & when you attack women's health you attack America's health.' url,1,0.3994,0.6006,5552
Thought it was Friday all day today. Was beyond devastated when I realised it wasn't ??,0,1.0,0.0,5553
mention I felt bad for Romero. He cared but mental stuff sunk his career. I worry same thing will happen to Hutch. #BlueJays,0,1.0,0.0,5554
*NEW* Snap On Tools Black baseball Hat/Cap Silver/Gray Embroidered S Logo Flames - Full reU_ url url,0,1.0,0.0,5555
mention  we know who u are you're a bleeding heart wannabe pickup artist,0,1.0,0.0,5556
Ended today's staff meeting with the teacher version of 'I Will Survive' #tootrue url,0,1.0,0.0,5557
1.94 earthquake occurred 5km S of Volcano Hawaii at 01:04 UTC! #earthquake #Volcano url,1,0.0,1.0,5558
Plane debris is from missing MH370 url,1,0.0,1.0,5559
We're #hiring! Click to apply: Registered Nurse - Emergency Department PEDS Fellowship (FTE .9 Night) - url #Nursing,0,1.0,0.0,5560
Crash,0,0.8024,0.1976,5561
Per Malaysia's PM 'this piece of debris ... is conclusively a part from the wing of #MH370.' More right now url,1,0.0,1.0,5562
: Pandemonium In Aba As Woman Delivers Baby Without Face (Photos) - url,0,0.8,0.2,5563
Apply now to work for Dilawri as #BODY #SHOP/COLLISION CENTRE MANAGER in #Vancouver #jobs url url,0,0.7958,0.20420000000000005,5564
Schools in Western Uganda still Burning down Buildings during Strikes....Strikes in Western Uganda always Lit literally..,1,0.0,1.0,5565
mention didn't look like a murder scene just 1 cops a fire truck and 2 fire assistance cars along with a helicopter,1,0.1988,0.8012,5566
mention GIVE ME FREE ART KAMON,0,0.7962,0.2038,5567
More than 40 families affected by the fatal outbreak of Legionnaires' disease in Edinburgh are to sue two comp... url,1,0.0,1.0,5568
[Tropical Cyclone Info] SOUDELOR 945hPa maximum wind speed: 45m/s maximum wind gust speed: 60m/s  url,1,0.2,0.8,5569
US govt refuses to evacuate 1000s of Americans from Yemen url #yemen #usa #evacuation #abandoned,1,0.0,1.0,5570
:: Survive??,0,0.7998,0.20020000000000004,5571
mention I have the Forrest version from '83 that's bloody awful as well :))) xxx,0,0.7976,0.2024,5572
They sky was ablaze tonight in Los Angeles. I'm expecting IG and FB to be filled with sunset shots if I know my peeps!!,0,0.8008,0.19920000000000004,5573
Cross-border terrorism: Pakistan caught red-handed again - The Times of India url,1,0.0,1.0,5574
Mass murderer Che Guevara greeting a woman in North Korea url,1,0.3989,0.6011,5575
mention mention bleeding wild things running around the apartment while hes in work at the bar ????????,0,0.8033,0.1967,5576
You can't use as much water in a drought as you can with a flood!,1,0.3934,0.6066,5577
mention the deal is clear.Iran either agrees to the deal and abandons it program or gets bombed.it's a deal the right wing should love,0,1.0,0.0,5578
mention It might have come out ONLY too burst as a Bomb making him suicide bomber,1,0.3988,0.6012,5579
Russian Ufood crematoriaUa provoke outrage amid crisis famineaEmemories url,1,0.16369999999999996,0.8363,5580
mention don't worry I'm sure climate has nothing to do with hail floods tornados in Alberta & Ontario. I'm sure god's just mad at you.,1,0.0,1.0,5581
mention SCREAMING,0,1.0,0.0,5582
GOP debate drinking game. For anyone looking for a bit of fun while watching this train wreck. url url,0,0.6005,0.3995,5583
ll//ll= Pic of 16yr old PKK suicide bomber who detonated bomb in Turkey Army trench released url /,1,0.0,1.0,5584
mention ooh now I feel guilty about wishing hatman out. I bet the mudslide was delicious!,0,1.0,0.0,5585
The Hobbit: The Desolation of Smaug - Ed Sheeran 'I See Fire' [HD] url,0,0.7982,0.2018,5586
mention I JUST SCREAMED TO MYSELF BECAUSE YEAH,0,1.0,0.0,5587
China's Stock Market Crash: Are There Gems In The Rubble? url,0,0.6018,0.3982,5588
Dysfunctional McConnell plans on holding Judicial Nominations hostage. Another example of how GOP canUat govern. url U_,0,0.8027,0.1973000000000001,5589
Refugio oil spill may have been costlier bigger than projected url,1,0.0,1.0,5590
Jacksonville Busines FedEx stops shipping potential bioterror pathogens url,1,0.2007,0.7993,5591
A Pyrotechnic Artwork by Cai Guo-Qiang Explodes into a Blossom on the Steps of the Philadelphia... url,1,0.3955,0.6045,5592
Artifacts found in southern Indiana landslide near Horseshoe Casino url url,0,0.6002,0.3998,5593
"Generational UBritish schismUa over privacy threat of drones url
  #drones #privacy url",0,1.0,0.0,5594
"Truth...
url
#News
#BBC
#CNN
#Islam
#Truth
#god
#ISIS
#terrorism
#Quran
#Lies url",1,0.1964,0.8036,5595
I'll let Louis drown me at the water wall by the mall If that makes him smile,0,1.0,0.0,5596
mention 'IUad worked so hard to get to that level that I wasnUat going to let the injury define me. I was going to define it.U Cool,0,0.8317,0.1683,5597
Refugio oil spill may have been costlier bigger than projected: A Plains All American PipelineU_ url #globetrottingwino,1,0.2845,0.7155,5598
url 'Nagasaki has to be forever the last city bombed with a nuclear weapon.' #bannukes,1,0.19700000000000006,0.8029999999999999,5599
mention Probably. We are inundated with them most years!,0,1.0,0.0,5600
China's Stock Market Crash: Are There Gems In The Rubble?: ChinaUas stock market crash this summer h... url by .Forbes,0,0.603,0.397,5601
mention been on tour in the day to Hellfire caves! Would love to investigate the place though!,0,0.8371,0.16290000000000004,5602
Bloody insomnia again! Grrrr!! #Insomnia,1,0.0,1.0,5603
mention more like demolition derby ??,0,1.0,0.0,5604
url Twelve feared killed in Pakistani air ambulance helicopter crash url,1,0.0,1.0,5605
niggas love hating.,0,1.0,0.0,5606
Love wounds,0,1.0,0.0,5607
screams into void? url,0,1.0,0.0,5608
Despite the deluge of #FantasticFour notices our man O'Cuana is still buying tickets - because he's bloody-minded like that.,0,1.0,0.0,5609
To fight bioterrorism sir.,0,0.7982,0.2018,5610
#TweetLikeItsSeptember11th2001 Those two buildings are on fire,1,0.0,1.0,5611
mention mention Cop Benefits:Great Salary Free Car Free Rent Free Food.Free Weapons License to Kill & Rape with Impunity.,0,0.7993,0.2007,5612
mention you feel trapped innit ??,0,0.7971,0.2029,5613
mention that's not my take from his piece. Not putting that ambition in check will destroy the change we voted for the change we seek,0,1.0,0.0,5614
Obama Declares Disaster for Typhoon-Devastated Saipan: Obama signs disaster declaration for Northern Marians a... url,1,0.0,1.0,5615
#USGS M 1.4 - 4km E of Interlaken California: Time2015-08-06 00:52:25 UTC2015-08-05 17:52:25 -07:00 at ep... url #SM,0,0.6024,0.3976,5616
"mention 
Due to upheaval created by the west in Iraq Syria Libya etc.",1,0.1983000000000001,0.8017,5617
Citizens Education Project has acted for years as a watchdog on the Dugway Proving Grounds. url,0,0.8733,0.12670000000000006,5618
Experts in France begin examining airplane debris found on Reunion Island: French air accident experts on Wedn...  url,1,0.0,1.0,5619
Rescued Med migrants arrive in Sicily url,1,0.0,1.0,5620
Angry Woman Openly Accuses NEMA Of Stealing Relief Materials Meant For IDPs: An angry Internally Displaced wom... url,1,0.3976,0.6024,5621
FedEx no longer to transport bioterror germs in wake of anthrax lab mishaps url via mention,1,0.397,0.603,5622
New Explosion-proof Tempered Glass Screen Protector Film for Blackberry Z10 - Full read byU_ url url,0,1.0,0.0,5623
Black Eye 9: A space battle occurred at Star O784 involving 2 fleets totaling 3939 ships with 11 destroyed,0,0.6018,0.3982,5624
wild night in the village of pugwash every fire truck is out that the town has which is like a fire truck for every house -population:6,1,0.2014,0.7986,5625
Maj Muzzamil Pilot Offr of MI-17 crashed near Mansehra today. May Almighty give strength to family to bear the loss url,1,0.0,1.0,5626
British diver Neil Anthony Fears found dead by the wreck of a steamship - Daily Mail url,1,0.0,1.0,5627
Exploring New Worlds: Three Moments of an Explosion by China MiIville url url,1,0.3976,0.6024,5628
I liked a mention video from mention url Smention 109 - sN | vaBengal (ZSS) Vs. SWS | Fatality (Captain Falcon),0,1.0,0.0,5629
mention civil rights continued in the 60s. And what about trans-generational trauma? if anything we should listen to the Americans.,0,0.8006,0.1994,5630
Interesting in watching a train wreck while taking acid kind of way url,0,1.0,0.0,5631
"Kaduna Begins Demolition Of Buildings On Govt School Lands
url",1,0.0,1.0,5632
Random wind gust just came through #Gander.  Probably some convection outflow.  Haven't heard any thunder yet but a few spits of rain #nlwx,1,0.3994,0.6006,5633
wowo--=== 12000 Nigerian refugees repatriated from Cameroon,1,0.1988,0.8012,5634
Uganda Seen as a Front Line in the Bioterrorism Fight,1,0.19530000000000008,0.8047,5635
Wild fires in California... Must be Global Warming. Can't just be extreme heat combined with dry foliage ignited by some douchebag hiker.,1,0.0,1.0,5636
New music from mention featuring M.O.P.? 'Detonate' taken off his album 'Grandeur' coming soon - url,0,1.0,0.0,5637
Suicide Bomber Kills More Than a Dozen in Saudi Mosque: Saudi Arabia have started experiencing some terrorist ... url,1,0.0,1.0,5638
mention PHOTOS from Green Line derailment url url,1,0.0,1.0,5639
url Had a #personalinjury accident this summer? Read our advice & see how a #solicitor can help #OtleyHour,0,1.0,0.0,5640
6th July 1945 ...Hiroshima was bombed with nuclear weapon _bomb was named little boy&carried in a plane called Enola Gay ...1/2,1,0.0,1.0,5641
#LatestNews: Tension In Bayelsa As Patience Jonathan Plans To Hijack APC PDP,1,0.0,1.0,5642
mention mention The Allies forecast an Invasion of Japan had a minimum of 1 million casualties that is a minimum.,1,0.0,1.0,5643
Reddit Will Now Quarantine Offensive Content: Reddit co-founder and CEO Steve Huffman has unveiled more specif... url,0,1.0,0.0,5644
Don avoid wearing dead black flaming red and stark white so much and esp. at debate; go with your blue gold brown even to shoes; and,0,1.0,0.0,5645
What is the biggest regret you have in hearthstone? url,0,1.0,0.0,5646
url  Cindy Noonanmention in #Baltimore #Rioting #YAHIstorical #UndergroundRailraod,1,0.1976,0.8024,5647
You know it's hot when there are bush fires right near your villa ????,1,0.1988,0.8012,5648
At #BlackHat? Learn about account hijacking attacks & cloud access security w/ mention url url,0,0.8006,0.1994,5649
When life is cheap evil abounds and mention mention profit from its destruction.#DefundPP url,0,1.0,0.0,5650
mention I got it for the mistake but boss got it worse cause their job was to oversee my work. Boss didn't change after that...,0,1.0,0.0,5651
? Cracker - White Riot ? url #nowplaying,0,1.0,0.0,5652
U.S. Forest Service says spending more than half of budget on fires: By Ian SimpsonU_ url,1,0.0,1.0,5653
mention you already know how this shit goes. World Series or Armageddon.,0,0.7958,0.20420000000000005,5654
#NoSurrender Results: Full Metal Mayhem World Title Match Bully Ray Taken Out A Career Comes To An End and More! url,0,0.8534,0.14659999999999995,5655
Langhorne-Middletown Fire Co. welcomes new truck ... url,0,1.0,0.0,5656
Heavy rain frequent thunder and gusty winds moving into parts of Uptown and Midtown. url - CN url,1,0.0,1.0,5657
'CALIFORNIA IS BURNING:' Gov. Jerry Brown told reporters at a press conference that California is experiencing... url,1,0.0,1.0,5658
mention man you kno I'm there !,0,0.8556,0.14439999999999995,5659
mention mention what a disaster - can't say I'm surprised,0,0.8599,0.1401,5660
Freed #BokoHaram captives speak up: UII will make sure she goes to school.' mention url url,0,1.0,0.0,5661
Some good info to help first responders cope- Individual Resilience: Factsheet for Responders- url,0,0.7988,0.20120000000000005,5662
Multiple Buildings On Fire In Downtown Hinton url url,1,0.0,1.0,5663
games that I really hope to see in AGDQ: Trauma Center Second Opinion Kororinpa Marble Mania TLoZ Oracle of Ages Metroid II,0,1.0,0.0,5664
"#cum explosion!

mention 
mention 
mention 
mention 
mention
mention
mention
mention url",0,1.0,0.0,5665
mention mention I feel like I'm going to do it on accident. Teesha is gonna come out??,0,0.7983,0.2017,5666
The chick I work with chews chewing gum so loud ?? feel to bang her,0,1.0,0.0,5667
"Mom is hijacking my account to earn MCR STATUS!!!  Get your own account snort!  
url #FlavorChargedTea",0,1.0,0.0,5668
Sinkhole on west side damaging cars via mention url,1,0.0,1.0,5669
Motorcyclist bicyclist injured in Denver collision on Broadway: At least two people were taken to a localU_ url,1,0.0,1.0,5670
#science Now that a piece of wreckage from flight MH370 has been confirmed on RIunion Island is it possible t...  url,1,0.19700000000000006,0.8029999999999999,5671
To All The Meat-Loving Feminists Of The World Riot Grill Has Arrived: Pop quiz! Which do you prefer: fem... url #art,0,1.0,0.0,5672
I can't believe mention photo bombed a screenshot,0,1.0,0.0,5673
You are the avalanche. One world away. My make believing. While I'm wide awake.,0,0.7981,0.2019,5674
-  Pandemonium In Aba As Woman Delivers Baby Without Face url url,0,0.7982,0.2018,5675
mention THX for your great encouragement and for RT of NEW VIDEO url The Coming Apocalyptic US Earthquake & Tsunami,1,0.0,1.0,5676
Monkey just collided heads with our Ninja. Commence the tears :(,0,1.0,0.0,5677
To All The Meat-Loving Feminists Of The World Riot Grill Has Arrived url mention,0,1.0,0.0,5678
mention alrighty Hit me up and we'll blaze!!,0,1.0,0.0,5679
Army names 10th Mountain units for Iraq Afghanistan deployments (Deeds) url,0,0.6024,0.3976,5680
.POTUS #StrategicPatience is a strategy for #Genocide; refugees; IDP Internally displaced people; horror; etc. url,1,0.0,1.0,5681
"and if I cry two tears for her..
That will be the most that I would giveU_ url",0,1.0,0.0,5682
Loved Chicago so much that it game me Pink Eye. Now I sit and design in quarantine and in the dark.,0,1.0,0.0,5683
Even with delays? Like a bogged down cpu? #gunsense mention mention mention,0,1.0,0.0,5684
RIunion Debris Is Almost Surely From Flight 370 Officials Say - New York Times url,1,0.0,1.0,5685
Emergency units simulate a chemical explosion at NU: Suppose a student in the research labs at NorthwesternU_ url,1,0.0,1.0,5686
day 1 of tryouts went good minus the fact I stopped quickly to get a short ball and Annihilated my toenail injury even more,0,0.7964,0.2036,5687
mention mention mention mention I think the risk of losing and getting her nose flattened has a lot to do with it,0,1.0,0.0,5688
mention What you don't think the Allies should have just sucked up 1 million casualties?,1,0.2036,0.7964,5689
I-77 Mile Marker 31 South Mooresville  Iredell Vehicle Accident Ramp Closed at 8/6 1:18 PM,1,0.0,1.0,5690
Busty blonde teen Natalia Starr fucks the security guard on set url View and download video,0,1.0,0.0,5691
quoted here-->CNN: Purported ISIS video threatens Croatian hostage url,1,0.0,1.0,5692
mention but I can't say that either of us should be displeased. U.S move up five spots Jamaica 21! Congrats to the #ReggaeBoyz,0,0.8024,0.1976,5693
Butt Trauma Extraordinaire,1,0.3936,0.6064,5694
"In your eyes I see the hope
I once knew.
I'm sinking.
I'm sinking
away from you.
Don't turn around
you'll see...

You can make it.",0,0.7994,0.2006,5695
Myanmar: MSF assisting thousands as worst flooding in decades hits parts of Myanmar url,1,0.0,1.0,5696
via Jerusalem Post: WATCH: Israel performs controlled detonation of land mines on Golan Heights... url,1,0.3964,0.6036,5697
#helpme what do I do? My friend has been ticketed by Police in Wayne County Michigan into never- sending poverty cycle. How do I help him?,0,1.0,0.0,5698
C-130 specially modified to land in a stadium and rescue hostages in Iran in 1980... url url,1,0.1703,0.8297,5699
[#Latestnews] Police officer wounded suspect dead after exchanging shots: RICHMOND Va. (AP) UO A Richmond pol... url,1,0.0,1.0,5700
no escape- no place to hide here where time and space collide,0,0.7988,0.20120000000000005,5701
Businesses cre deluged with invoices. Make yours stand out with colour or shape and it's likely to rise to the top of the pay' cile.,0,1.0,0.0,5702
New item: Pillow Covers ANY SIZE Pillow Cover Grey Pillow Pillows Premier Prints Lulu Storm Grey by MyPillowStudio U_ url,0,0.8017,0.1983000000000001,5703
Fear is the mind killer. Fear is the little-death that brings total obliteration.  Bene Gesserit Litany Against Fear Dune   mention,0,0.6024,0.3976,5704
im sooooooo full my stomach is going to explode,1,0.1999,0.8001,5705
"But...! Oh! 

How rich the soil?!

How wonderful the upheaval!?

-mention",0,1.0,0.0,5706
The year is 2065 and the national society of meme preservation has opened the first museum where memes and their origins are displaced,0,1.0,0.0,5707
Element of Freedom: The Biggest Party of the Summer @ Mirage Saturday! Tickets at url,0,0.7994,0.2006,5708
Hiroshima marks 70 years since bomb url,1,0.1983000000000001,0.8017,5709
Evacuation order lifted for town of Roosevelt - Washington Times url,1,0.20130000000000006,0.7987,5710
4 Common Running Injuries and How to Avoid Them url,0,1.0,0.0,5711
Aircraft debris confirmed to be from MH370 - Nation | The Star Online url,1,0.3952,0.6048,5712
#Flashflood causes #landslide in Gilgit #Pakistan Damage to 20 homes farmland roads and bridges #365disasters  url,1,0.0,1.0,5713
Wreckage 'Conclusively Confirmed' as From MH370: Malaysia PM: Investigators and the families of those who were... url,1,0.0,1.0,5714
The crocodile tears don't wash with me she's more upset that the gravy train has been derailed #kidscompany url,1,0.3982,0.6018,5715
Jeep Cherokee Owners File Lawsuit Against Fiat Chrysler Harman After Hackers ... - The Consumerist url #mcgsecure,0,0.8317,0.1683,5716
Businesses are deluged with invoices. Make yours stand oup with colour or shame and it's likely to rise to the top of the pay' pile.,0,1.0,0.0,5717
No mention tonight?? how will I survive?! mention mention,0,1.0,0.0,5718
The latest from mention reveals #Storm is a queen in #Apocalypse mention mention url,1,0.3962,0.6038,5719
someone just reblogged a picture of self harm scars oh please its 2015 can we stop,0,1.0,0.0,5720
#hot#teen#nsfw#porn#milf: Oiled Up Ass Hole Is Destroyed With King Size Cock Closeup Sex Clip url,0,0.8,0.2,5721
'Nobody remembers who came in second.' Charles Schulz,0,1.0,0.0,5722
Judges considering fate of children as young as two amid radicalisation fears url,0,0.6001,0.3999,5723
BLOODY HELL TEEN WOLF *O* Hayden and Liam are so cute :3 And I think Stiles's Jeep is dead huh ? Pleeease... I loved her ! mention,0,0.7988,0.20120000000000005,5724
Suspect in latest US theatre attack had psychological issues url url,1,0.0,1.0,5725
mention mention That Raspy is so cool and he has already figured out TTK's battle shit.,0,1.0,0.0,5726
"No #news of #hostages in #Libya

url

#India #terrorism #Africa #AP #TS #NRI #News #TRS #TDP #BJP url",1,0.0,1.0,5727
What's going on in Hollywood? #abc7eyewitness mention helicopters and sirens. #HometownGlory,0,1.0,0.0,5728
Ashes 2015: Rampant England humiliate rival Australia url,0,0.8059999999999999,0.19400000000000006,5729
Got a ticket & my car got crashed  man life's great !,1,0.3976,0.6024,5730
mention That sounds like the perfect bread! I'll hit up Trader Joes this wknd ??. Not really lol Already being inundated with,0,0.7994,0.2006,5731
Here comes the next Episode #Scorpion #Cyclone mention,0,0.7982,0.2018,5732
Strict liability in the context of an airplane accident - url,1,0.19920000000000004,0.8008,5733
Christian Attacked by Muslims at the Temple Mount after Waving Israeli Flag via Pamela Geller - ... url,1,0.1976,0.8024,5734
mention Thx for emergency dec. url 4 days and no plan to get H20 to those who have no transport. Can you deploy troops?,1,0.1988,0.8012,5735
mention keep an eye out we'll be looking for lots of new team members in coming days/weeks :),0,1.0,0.0,5736
Photo: Beach Earrings Beach Jewelry Vacation Earrings Keep Calm and Beach On Earrings Made with Flattened... url,0,1.0,0.0,5737
lets hope this concert ends with zero casualties amen,0,1.0,0.0,5738
...//..// whao.. 12000 Nigerian refugees repatriated from Cameroon url,1,0.0,1.0,5739
mention mention & the stat of high auto deaths applies to children in a vehicle. I guess they can out run lightrail better than adult,0,0.8027,0.1973000000000001,5740
My room looks like a tornado passed through it and my OCD is not having it.,0,1.0,0.0,5741
If you don't have anything nice to say you can come sit with me.,0,1.0,0.0,5742
mention he sounds more like panic at the disco ??,0,0.7976,0.2024,5743
Haunting memories drawn by survivors url via cnnbrk CNN #news,1,0.20020000000000004,0.7998,5744
Hiroshima and Nagasaki I remember all those killed in alleged US war crimes using nuclear weapons url #USWarCrimes,1,0.0,1.0,5745
I'm in utter shock and devastation you don't go to work to be left feeling how I do now. Life really is too short ??,1,0.19510000000000005,0.8049,5746
How to Remove Softenza Hijacker? Softenza Anthelmintic Nature book Drawing out Help SEA,0,0.797,0.203,5747
Black Eye 9: A space battle occurred at Star O784 involving 2 fleets totaling 3946 ships with 14 destroyed,1,0.2,0.8,5748
We happily support mydrought  a project bringing awareness to the LA drought. Track your waterU_ url,1,0.0,1.0,5749
Just Happened in Asia: Japan marks 70th anniversary of Hiroshima atomic bombing url,1,0.0,1.0,5750
Man faces manslaughter charges following fatal Sunday wreck | AL.c.. Related Articles: url,1,0.20120000000000005,0.7988,5751
"#Rick Grimes: 'We'll survive. I'll show you how.'

#TheWalkingDead
Season 5
#Conquer
29 Mar 2015 url",0,1.0,0.0,5752
03/08/11: Police stop a 41-year-old in the Bronx citing 'casing a victim or location.' No weapon is found.,1,0.2,0.8,5753
When the game tells you to stop going to the Nether by spawning you right over lava. GG mention url,0,1.0,0.0,5754
Credit to mention for inspiring me to rediscover this fantabulous #tbt url,0,0.7982,0.2018,5755
Families to sue over Legionnaires: More than 40 families affected by the fatal outbreak of Legionnaires' disea... url,1,0.0,1.0,5756
WAS Times: PawSox owners public return from whirlwind trip to Durham url,0,0.6024,0.3976,5757
HELLFIRE EP - SILENTMIND & mention  url,0,0.6024,0.3976,5758
Lying Clinton sinking! Donald Trump singing: Let's Make America Great Again! url,0,1.0,0.0,5759
Demolished My Personal Best  url,0,0.7992,0.2008,5760
Well as I was chaning an iPad screen it fucking exploded and glass went all over the place. Looks like my job is going to need a new one.,0,0.8006,0.1994,5761
mention mention mention ouch. He needs to explain why his NYCLASS $500K hate mailer was such catastrophic fail,0,1.0,0.0,5762
mention Gabriel obliterated his fibula,0,1.0,0.0,5763
