text,crowd_label,conf0,conf1,itemID
My Instagram just blew up apparently I was featured on I am jazz tonight. How cool is that love her,0,1.0,0.0,3828
Legionnaires' Disease: What's Being Done to Stop Deadly Outbreak: The worst-ever outbreak of Legio... url #losangeles,1,0.0,1.0,3829
mention go to sleep before someone screams at us??????,0,1.0,0.0,3830
RT: janenelson097: RT StephenSCIFI: Adaptation Watch: Charlie Human's APOCALYPSE NOW NOW Optioned for Film #sciencefiction U_,0,0.8554,0.14459999999999995,3831
Learning from the Legacy of a Catastrophic Eruption url,1,0.2039,0.7961,3832
im getting a car wow it hasn't sunk in,0,1.0,0.0,3833
mention mention I'M SCREAMING OMG #IDOLS #22DAYS #WDYM,0,1.0,0.0,3834
Big 30?? Hanging Out NO CURFEW,0,1.0,0.0,3835
Updated #RockyFire map with Mandatory Evacuation areas (red) Advisory Evacuation (yellow) 2 Evac Centers (green) url,1,0.0,1.0,3836
I'm only experienced with injuries below the waist,0,0.7982,0.2018,3837
'Suicide bombing at [location named]...' #premonitions url,1,0.0,1.0,3838
I'm blazing rn and there's nothing you can do to stop me,0,1.0,0.0,3839
Building structural integrity & failure: problems inspections damages defects testing repair | Rightways url,1,0.0,1.0,3840
Welcome mention mention mention mention mention #Family #Cleveland #StandUp mention url,0,0.7964,0.2036,3841
Physical sense helps preserve memories of 2011 triple disaster (8/4 AJW) url #jishin_e #nuclear #Minamisoma,1,0.0,1.0,3842
Nuclear #Solar Power #Japanese #Fukushima Reactor Energy Japan Temperature No. Fuel Pool More  url url,1,0.19820000000000004,0.8018,3843
mention mention bring in the rescue squad ??,1,0.1999,0.8001,3844
I have the experience performing cpr on a actual drowning victim.,1,0.3987000000000001,0.6013,3845
I'm bout to get in the shower an drown,0,1.0,0.0,3846
Dramatic Video Shows Plane Landing During Violent Storm url,1,0.0,1.0,3847
contemplating going to chilis just to get a molten lava cake ....??,0,1.0,0.0,3848
mention mention mention ...I'm no expert but raw uranium and nuclear reactor fuel rods are 2 very different creatures...,1,0.3994,0.6006,3849
Associated Agencies Inc. is #hiring Property & Casualty Account Manager url #jobs #RollingMeadows #Insurance,0,1.0,0.0,3850
mention Internally and externally screaming,1,0.3994,0.6006,3851
70 Years After Atomic Bombs Japan Still Struggles With War Past url The anniversary of the devastation wrought by theU_,1,0.0,1.0,3852
You know how they say the side effects low & really fast? Son the product was an acne cream.. Why 1 of the side effects was bloody diarrhea?,0,1.0,0.0,3853
Why did God order obliteration of ancient Canaanites? url via mention,0,1.0,0.0,3854
mention idkidk they're not breaking up although if they do i'll survive because solo harry bless,0,1.0,0.0,3855
Man my stomach feel like a tsunami ??.,0,1.0,0.0,3856
I added a video to a mention playlist url Howie Day - Collide,0,1.0,0.0,3857
'Dangerous' property in downtown Phoenix demolished  url,0,0.6005,0.3995,3858
Back from Seattle Tacoma and Portland. Whirlwind! url,1,0.20420000000000005,0.7958,3859
Don't Panik! #KelbyTomlinson to the rescue! url,0,1.0,0.0,3860
Free Kindle Book - Aug 3-7 - Thriller - Desolation Run by mention url,0,1.0,0.0,3861
Avalanche City - Sunset url #nowplay #listen #radio,1,0.3948,0.6052,3862
Dutch crane collapses demolishes houses: Dramatic eyewitness video captures the moment a Dutch crane hoisting...  url,1,0.0,1.0,3863
Foto: UILove isnUat everything to me anymore. The last album I made [Red] was a devastated record because... url,0,1.0,0.0,3864
I attacked Robot-lvl 19 and I've earned a total of 6615434 free satoshis! url #robotcoingame #Bitcoin #FreeBitcoin,0,1.0,0.0,3865
people with a #tattoo out there.. Are u allowed to donate blood and receive blood as well or not?,1,0.1977,0.8023,3866
Pizza drought is over I just couldn't anymore...,0,1.0,0.0,3867
New #job opening at Downtown Emergency Service Center in #Seattle - #Chemical #Dependency Counselor or Intern #jobs url,0,0.797,0.203,3868
Lets Goooooooo url,0,0.7964,0.2036,3869
Perfect night for a soak! Lava here I come?? url,0,1.0,0.0,3870
Pic of 16yr old PKK suicide bomber who detonated bomb in Turkey Army trench released url url,1,0.1401,0.8599,3871
MEG issues Hazardous Weather Outlook (HWO)  url #WX,1,0.1977,0.8023,3872
When something bad happens; you have 3 choices: You can either let it define you destroy you or let it strengthen you.,0,1.0,0.0,3873
Enugu Government to demolish illegal structures at International Conference Centre: Enugu State government app... url,0,0.6063,0.3937000000000001,3874
Mourning notices for stabbing arson victims stir Upolitics of griefUa in Israel url,1,0.0,1.0,3875
mention mention mention whether pressure or not NON wud not survived even if thalapathi didn't release,1,0.2006,0.7994,3876
"Imagine if 2 Old Gods were awakened to start a Blight 2.0
mention mention",0,1.0,0.0,3877
40 displaced by Ocean Township apartment fire #NewYork - url,1,0.19520000000000004,0.8048,3878
'Show Me a Hero': TV Review url url,0,1.0,0.0,3879
Rly tragedy in MP: Some live to recount horror: UIWhen I saw coaches of my train plunging into water I called ... url,1,0.0,1.0,3880
Oregon's biggest wildfire slows growth url via mention,1,0.0,1.0,3881
Casualty insurance jobs against hunt up willinghearted into: RPN url,0,1.0,0.0,3882
DK Eyewitness Travel Guide: Denmark: travel guide eBay auctions you should keep an eye on: url,0,1.0,0.0,3883
#USGS M 1.9 - 5km S of Volcano Hawaii: Time2015-08-06 01:04:01 UTC2015-08-05 15:04:01 -10:00 at epicenter... url #SM,1,0.0,1.0,3884
Do you feel engulfed with low self-image? Take the quiz: url url,0,1.0,0.0,3885
What the fuck was that. There was a loud bang and a flash of light outside. I'm pretty sure I'm not dead but what the hell??,0,0.6633,0.3367,3886
HillaryUas Bimbo Eruptions and Questionable Financial Dealings Should Derail Campaign url via mention,0,0.8321,0.16790000000000005,3887
mention ... He's gone. You can relax. I thought the wife who wrecked her cake was a goner mind lol #whoops,0,0.7981,0.2019,3888
'You can only be rescued from where you actually are and not from where you pretend you are.' Giorgio Hiatt,0,0.6658,0.33420000000000005,3889
Anyone need a P/U tonight? I play Hybrid Slayer ps4 EU. HMU mention mention mention mention mention mention,0,0.7966,0.20340000000000005,3890
Warne Ponting shocked by Australian collapse - Yahoo Cricket India url,0,1.0,0.0,3891
Robot_Rainstorm: We have two vacancies on the #Castle Fantasy Football team! Join us. ItUas fun. ??,0,0.8738,0.12619999999999998,3892
FREYAS VIDEO BLEW UP EVERYWHERE,0,1.0,0.0,3893
mention  Mega mood swing on a 24 hr schedule. Isn't that how structural failure occurs?,0,1.0,0.0,3894
mention -in the Vault that could take a look at those wounds of yours if you'd like to go to one of these places first.' Zarry has had-,0,1.0,0.0,3895
Two trains derail in central India's Madhya Pradesh url,1,0.0,1.0,3896
mention mention also me please I would very much like a link,0,0.6642,0.3358,3897
Gonna call up tomorrow with the aul 'emergency dental appointment' excuse just like the whole tooth falling out incident of last year,1,0.3994,0.6006,3898
Could Billboard's Hot 100 chart be displaced by these social-media-driven music charts?    url,1,0.3943,0.6057,3899
I feel like if MKayla and Cee ever got in the same room everyone should evacuate because it would be so petty and childish I couldn't deal,1,0.1988,0.8012,3900
Beat the #heat. Today only Kill Cliff Free Fall $2. Pick up a #cold drink today after the #tough #crossfit... url,0,1.0,0.0,3901
"150-Foot Sinkhole Opens in Lowndes County Residential Area
WCTV-35 minutes ago",1,0.16669999999999996,0.8333,3902
My portable closet has collapsed 3x and it finally broke and my mom said 'maybe u should get rid of some clothes' lol how about no,0,0.7968,0.20320000000000005,3903
mention If I may ask Cyclone-sama have you read Jailed Fate by Rindou?,0,0.7992,0.2008,3904
Literally trapped in my room Cuz my bathroom being remodeled. The only exit is through a window,1,0.3994,0.6006,3905
Wow 3 are WSEA RT mention Seattle's deadliest red light runner intersections revealed url url,0,0.8011,0.1989,3906
three episodes left the end is nigh,0,1.0,0.0,3907
mention control yourself tora,0,1.0,0.0,3908
mention she said a few months. But I get a curfew for out time smfh,0,0.8012,0.1988,3909
Panoramic Resources cuts jobs after seismic event url,1,0.1977,0.8023,3910
mention GM! I pray any attack of the enemy 2 derail ur destiny is blocked by the Lord & that He floods ur life w/heavenly Blessings,0,0.606,0.39399999999999996,3911
This Friday!! Palm Beach County #Grindhouse Series one night screening of  #TexasChainsawMassacre url mention,0,1.0,0.0,3912
Wtf? Her biological father is holding her hostage and her adoptive parents haven't even looked for her. Criminal minds got me fucked up.,0,0.8036,0.1964,3913
First time for everything! @ Coney Island Cyclone url,1,0.3994,0.6006,3914
OUN cancels Severe Thunderstorm Warning for Lincoln Logan Oklahoma [OK]  url #WX,1,0.1983000000000001,0.8017,3915
mention mention mention mention mention And by doing this you're enabling the possible collapse of the industry.,0,1.0,0.0,3916
you haven't ruined my day you've obliterated it into a million pieces and spit on it url,0,1.0,0.0,3917
mention Texans hope you are wrong. Radio in Houston have him as starter after Foster injury,0,0.6018,0.3982,3918
As California fires rage the Forest Service sounds the alarm about rising wildfire costs url,1,0.0,1.0,3919
mention yea in this photo,0,1.0,0.0,3920
mention mention together we can destroy the Emperor and rule the galaxy Father and Son!,0,1.0,0.0,3921
mention Police Officer Wounded Suspect Dead After Exchanging Shots url ushed,1,0.19810000000000005,0.8019,3922
Let her go - Passenger,0,1.0,0.0,3923
Remember #Hiroshima destroyed by #Nuclear bomb..an occurrence should never ever happen again yet highly likely recur url,1,0.0,1.0,3924
#Ukraine #Kyiv #News Radio Free Europe/Radio Liberty: Ukraine famine monument erected in ... url #Kiev #Ukrainian #Ua,1,0.1998,0.8002,3925
'Blaaaaaaa' he said as he sunk his face into your stomach making it vibrate mention,0,1.0,0.0,3926
UUIf your lost & alone or your sinking like a stone carry onaa,0,1.0,0.0,3927
Read an eyewitness account from #Hiroshima on Aug. 6 1945 url Mankind's worst invention.,1,0.2006,0.7994,3928
"Always look for the silver lining!  

My barn having burned to the ground
I can now see the moon.
~ Mizuta... url",0,0.6675,0.3325,3929
mention My feed seems to have a deluge once or twice during the week. ItUas fantastic.,0,0.8012,0.1988,3930
CIA plot! *rolling eyes* RT mention Chinese relatives of MH370 victims say reunion island wreckage was planted url,1,0.0,1.0,3931
Photo: weallheartonedirection: I wouldnUat let David electrocute himself so IUam the asshole url,0,1.0,0.0,3932
How American war planners singled out Hiroshima for destruction url,1,0.0,1.0,3933
#Nepal Magnitude 4.3 tremor rattles #Dolakha as #aftershock counts 367 | Recent Natural Disasters : url,1,0.0,1.0,3934
Stuart Broad Takes Eight Before Joe Root Runs Riot Against Aussies,0,0.7140000000000001,0.2859999999999999,3935
3 Years After the Sikh Temple Massacre Hate-Violence Prevention Is Key | Colorlines url,1,0.0,1.0,3936
The trouble in one of Buffett's favorite sectors url,0,1.0,0.0,3937
"mention favourite YouTube channel going right now.
Love everything you guys do and thank you introducing me to Dude Bro Party Massacre",0,1.0,0.0,3938
LIKE I SWEAR THE SECRET WE'LL UNCOVER IS THE OLD GODS IN A SLUMBER. I THINK THERES GONNA BE ANOTHER BLIGHT,0,1.0,0.0,3939
That triumphant moment when you cook up two eggs over easy with no yolk casualties ?? url,0,1.0,0.0,3940
Deals : url #37592 Temporary Fake Tooth Teeth Replacement Kit Emergency Dental Oral Care CosmeU_ url,0,1.0,0.0,3941
Marquei como visto Dragon Ball Super - 1x1 - The God of Destruction\'s Dream url #bancodeseries,0,0.797,0.203,3942
My dog attacked me for my food #pugprobs,0,1.0,0.0,3943
Survival Kit Whistle Fire Starter Wire Saw Cree Torch Emergency Blanket S knife  - Full reU_ url url,1,0.0,1.0,3944
I think Twitter was invented to keep us insomniacs from rioting in the wee small hours.,0,0.6054,0.3946,3945
I have an unexplainable desire to watch The Rescuers. #childhooddefined,0,1.0,0.0,3946
"HIS MAJESTY EMPEROR SALMAN KHAN'S UNSTOPPABLE CYCLONE OF ENTERTAINMENT HUMANITY
BAJRANGI BHAIJAAN CREATING HISTORY EVERYWHERE 
CROSED 300 CR",0,1.0,0.0,3947
Why can't gay men donate blood? url url,0,0.8,0.2,3948
Refugio oil spill may have been costlier bigger than projected url,1,0.0,1.0,3949
#Dime_Miloko Officer Wounded Suspect Killed in Exchange of Gunfire: Richmond police officer wounded suspect killed in exchange of gunfire,1,0.0,1.0,3950
Men escape car engulfed in flames in Parley's Canyon crews investigating cause - url url,1,0.0,1.0,3951
INEC Office in Abia Set Ablaze - url,1,0.0,1.0,3952
One thing you can be sure of. There will never be bush fires in Scotland as the ground is always soaking wet????,0,0.6006,0.3994,3953
5 Rejected Mortal Kombat Fatalities: Mortal Kombat has stretched the boundaries of itsU_ url url,0,0.6006,0.3994,3954
Hundreds of migrants feared drowned off Libya: Migrants stand next to their tent at a camp set near CalaisU_ url,1,0.0,1.0,3955
"Come and join us Tomorrow!
August 7 2015 at Transcend:Blazing the Trail to the Diversified World of Marketing... url",0,1.0,0.0,3956
Hundreds feared drowned as migrant boat capsizes off Libya: Hundreds of migrants are feared to have drowned af... url,1,0.0,1.0,3957
Evacuation order lifted for Roosevelt after #Wildfire misses town - KOMO News url,1,0.0,1.0,3958
You wanna ruin a relationship? Just ask 'what are your intentions' and you'll do it,0,1.0,0.0,3959
Detonation into the realistic assets entering india: koZ url,0,0.8,0.2,3960
RT mention Owner of Chicago-Area Gay Bar Admits to Arson Scheme url #p2 #LGBT,1,0.0,1.0,3961
Private thirsty night?SAD BLOOD ROCK'N ROLL? #??,1,0.3994,0.6006,3962
Suicide bomber kills 15 in Saudi security site mosque - Reuters url url,1,0.0,1.0,3963
Do you know your hurricane evacuation route? Find it here: url,1,0.0,1.0,3964
"day 3 without my phone and due to my slow shite computers it is utter hellfire :'(
Plez send help",0,0.7982,0.2018,3965
Cramer: Iger's 3 words that wrecked Disney's stock url,0,1.0,0.0,3966
#science Now that a piece of wreckage from flight MH370 has been confirmed on RIunion Island is it possible t...  url,1,0.0,1.0,3967
North Sac Elkhorn Blvd / Walerga Rd **Trfc Collision-1141 Enrt** url,1,0.3976,0.6024,3968
Good thing there was actually just a legit fire in the mall and nobody evacuated!!,1,0.0,1.0,3969
mention You were bleeding my instincts kicked in. *She looks away and scratches the back of her head*,0,1.0,0.0,3970
'I'm there!' Bride & Groom on mountain cliff edge. Ha Ha just kidding. I WILL NOT EVER be there. Ha Ha - url,0,0.603,0.397,3971
UImention Investigators rule catastrophic structural failure resulted in 2014 Virgin Galactic crash url,1,0.0,1.0,3972
Pandemonium In Aba As Woman Delivers Baby Without Face (Photos): According to eye witnesses in Ogbor Hill in A... url,1,0.1999,0.8001,3973
Men escape car engulfed in flames in Parley's Canyon crews investigating cause - url url,1,0.19530000000000008,0.8047,3974
mention mention mention mention mention mention mention the wall Israel erected has stopped suicide bombing?,0,0.6594,0.3406,3975
#?? #?? #??? #??? Suicide bomber kills 15 in Saudi security site mosque - Reuters  url,1,0.0,1.0,3976
Hiroshima survivors fight nuclear industry in Brazil UO video url,1,0.0,1.0,3977
This Looney Tunes-Blake Griffin commercial screams their making a Space Jam 2,0,1.0,0.0,3978
U.S National Park Services Tonto National Forest: Stop the Annihilation of the Salt River Wild Horse... url via mention,0,0.6692,0.3308,3979
Paul Rudd Emile Hirsch David Gordon Green 'Prince Avalanche' Q&A | Filmmakers at Google url  #entretenimento #Video,0,1.0,0.0,3980
mention two hours of Sandstorm remixes. All merged together. No between-song silence.,0,0.6018,0.3982,3981
mention mention SCREAMING,0,1.0,0.0,3982
and no one knows that i'm drowning and i know that i can't fcking survive,0,1.0,0.0,3983
Vote for #Directioners vs #Queens in the 5th round of the mention #FanArmyFaceOff url,0,1.0,0.0,3984
Add these items to your everyday eating habits. Please do the research on how to take with your bloodU_ url,0,0.7958,0.20420000000000005,3985
mention I didn't either till it blew up my mentions lol,0,1.0,0.0,3986
#hot  Funtenna: hijacking computers to send data as sound waves [Black Hat 2015] url #prebreak #best,1,0.3934,0.6066,3987
Sinkhole Disrupts Downtown Trolley Service #SanDiego - url,1,0.0,1.0,3988
Praise God that we have ministry that tells it like it is!!! #now #wdyouth #biblestudy url,0,1.0,0.0,3989
On the eve of Jon Stewart leaving The Daily Show WMATA has honored him by letting another train get derailed and crippling the service.,1,0.1988,0.8012,3990
"**Let - Me - Be - Your - Hot - Blazing - Fantasy**  
#escorts #gfe #DUBAI url",0,1.0,0.0,3991
Sounds pretty sensible for a mass murderer... url,1,0.20130000000000006,0.7987,3992
mention perhaps you should change you name to yahoo doesn't care.  Are you so inundated with complaints that you cannot respond to me??,0,1.0,0.0,3993
mention mention i screamed after hitting tweet,0,0.7993,0.2007,3994
I just rescued you in MGS Ground Zeroes mention  haha. Amazing...Sept 1st cant come soon enough :),0,1.0,0.0,3995
#hot  C-130 specially modified to land in a stadium and rescue hostages in Iran in 1980 url #prebreak #best,1,0.0,1.0,3996
mention i wish i was good enough to add flames to my nails im on fire,1,0.39399999999999996,0.606,3997
"TimesNewsdesk : Police link beach massacre to Tunisia museum attack
U_ url url",1,0.0,1.0,3998
Chilli heat wave Doritos never fail!,0,0.8317,0.1683,3999
New Explosion-proof Tempered Glass Screen Protector Film for Blackberry Z10 - Full read byU_ url url,0,0.6005,0.3995,4000
The U.S. bombed Hiroshima 70 years ago today. A look at how war has changed since: url url,1,0.0,1.0,4001
The Sharper Image Viper 24' Hardside Twister (Black) url,0,1.0,0.0,4002
mention Remind Me of Blood Sosa From Belly.....do your homework.,0,0.6018,0.3982,4003
By the grace of GOD I survived the 2am shift and im not that tired.,0,1.0,0.0,4004
#NowPlaying  - Lamb of God - Desolation url,0,1.0,0.0,4005
mention LMFAO,0,0.7952,0.2048,4006
Massive Sinkhole Emerges In Brooklyn url url,1,0.0,1.0,4007
He hit a tailor fucking made double play and Kay screams he was robbed of a hit.,0,1.0,0.0,4008
An Eau Claire man who police said was drunk when his SUV collided with a train was sentenced in Chippewa County: url,1,0.0,1.0,4009
I'm that traumatised that I can't even spell properly! Excuse the typos!,0,0.8,0.2,4010
mention mention Jamie is too traumatised to answer url,0,1.0,0.0,4011
I just screamed what the fuck is a hond,0,0.7992,0.2008,4012
Final #Medinah update: shot a 105. 49 on front (exploded with a) 56 on back. #ImKeepingMyDayJob (pic is famous #17) url,1,0.3976,0.6024,4013
mention Amen today is the Day of Salvation. THX brother Mike for your great encouragement. - url Coming US Tsunami,1,0.19400000000000006,0.8059999999999999,4014
Ford Truck Starts Up And Drives Off After Being DESTROYED By Tornado! url,1,0.19630000000000009,0.8037,4015
mention there are a few reasons for that but one of them is the constant Drake inundation.  Extremely annoying.  If Drake lands us a,0,0.8,0.2,4016
Storm batters top half of North Island: A violent overnight storm has battered the upper North Island uprootin... url,1,0.0,1.0,4017
Can you list 5 reasons why a London #TubeStrike is better than a Snowstorm? Read here... url,0,0.7091,0.29090000000000005,4018
suspected serial arsonist in east bay under arrest mention mention 10pm mention mention,1,0.0,1.0,4019
I got my wisdom teeth out yesterday and I just demolished a whole bowl of chicken Alfredo like its nothing...,0,0.6006,0.3994,4020
Motorcyclist bicyclist injured in Denver collision on Broadway: url by mention,1,0.2036,0.7964,4021
ML 2.0 SICILY ITALY url #euroquake,0,0.6024,0.3976,4022
Blood Group  A +ve is associated with Gastric Carcinoma says text book...Another fragile gene in my body....,0,0.6006,0.3994,4023
mention the whole city is trapped! You can't leave the city! This was supposed to be a normal sports manga wit a love triangle (c),1,0.2004,0.7996,4024
70 won 70...& some think possibility of my full transformation is impossible.  I don't quite like medical mysteries. BIOTERRORISM sucks.,0,0.6006,0.3994,4025
Rappers stop sampling police sirens and start sampling whale song.????,0,1.0,0.0,4026
mention aC and probably even more. But some disagreements with General Ross and the catastrophic occurrence made something clear. aE,0,0.8016,0.1984,4027
mention At first thought it was a blown-up DVD as I'm pretty sure POST MORTEM had been years back.,1,0.1977,0.8023,4028
mention then find cougars who look like her even better if they're in military uniform!,0,0.8,0.2,4029
"Apollo Brown-Detonate Featuring M.O.P.
url",0,0.797,0.203,4030
'It hasn't collapsed because the Greek people are still being played for as fools by Tsipras he costU_' UO WallyBaiter url,0,0.7161,0.28390000000000004,4031
320 [IR] ICEMOON [AFTERSHOCK] | url | mention | #Dubstep #TrapMusic #DnB #EDM #Dance #IcesU_ url,0,1.0,0.0,4032
Strikers in Phalaborwa striking over the CHINESE taking their jobs. Strikers burning buildings attacking cars 2... url,1,0.1978,0.8022,4033
I sent my emails why are the TRINNA hold me hostage  rapping me up ??,0,1.0,0.0,4034
These wild fires out west are crazy.,1,0.0,1.0,4035
In Lies We Trust #dvd CIA Hollywood and Bioterrorism Len Horowitz Vaccines Nwo url url,0,1.0,0.0,4036
UIWe live in an area thatUas inundated with wildlife...If people donUat learn how to get along or live with them... url,1,0.1957,0.8043,4037
mention Yes Yes! I will. I dont wanna ruin my life. Lol,0,0.8065,0.1935,4038
The bartender at work described a drunk man as annihilated mention mention mention 16 more days,0,0.8006,0.1994,4039
I just wanna ease your mind and make you feel alright.????,0,1.0,0.0,4040
How You Can Help The Community In The Event Of A Natural Disaster - url,1,0.1999,0.8001,4041
ITS A TIE DYE EXPLOSION ON IG HELP ME. IM DROWNING IN TIE DYE,1,0.0,1.0,4042
Palestinian rams car into Israeli soldiers wounding 3 url #EMM,1,0.0,1.0,4043
Photo: Bath & Body Works cosmetic bag in periwinkle blue with copper piping along the top and four corners.... url,0,1.0,0.0,4044
this is the first time a tweet has blown up almost half a day later... RE url,0,1.0,0.0,4045
Biolab safety concerns grow: FedEx stops transporting certain specimens. Research facilities 'dumbfounded' by action. url,0,0.8018,0.19820000000000004,4046
Zicac Vintage Leather Briefcase Messenger Satchel Tote Cross Body Handbags for Womens url,0,1.0,0.0,4047
"mention theres actually a theory out there that the magisters arent the only reason for the blight
that dwarves (the ones from the",0,1.0,0.0,4048
mention bombed on Kanye in that #ElephantInTheRoom ????????,1,0.1946,0.8054,4049
Fear and panic in the air I want to be free from desolation and despair!,0,0.6036,0.3964,4050
Moderate #drought is spreading rapidly across central Ga. #Macon #WarnerRobins #Dublin #Milledgeville #gawx url,1,0.0,1.0,4051
square just let booty org write xv im sure we'd do just fine (buildings around me set on fire),0,1.0,0.0,4052
Obama 2016? - The Abomination of Desolation' url,0,1.0,0.0,4053
mention GM! I pray any attack of the enemy 2 derail ur destiny is blocked by the Lord & that He floods ur life w/heavenly Blessings,0,0.6006,0.3994,4054
Debris confirmed from MH370; relatives hope for discovery of crash site url via mention #Video,1,0.0,1.0,4055
A group of Florida Forest Service firefighters could be deployed to California to help contain fires. Details at 10! url,1,0.0,1.0,4056
mention I hope they dust off the air raid sirens! You can quote me on that lol,0,0.8017,0.1983000000000001,4057
Dear mention In the name of humanityI apologized to #Hiroshima Survivors.R u ready to do so?#Japan #nuclearweapons url,1,0.0,1.0,4058
burned 129 calories doing 24 minutes of Walking 3.5 mph brisk pace #myfitnesspal,1,0.3982,0.6018,4059
#Winston #salem Fire in Pisgah National Forest grows to 375 acres url,1,0.0,1.0,4060
Three Israeli soldiers wounded in West Bank terrorist attack via /r/worldnews url,1,0.0,1.0,4061
A Cessna airplane accident in Ocampo Coahuila Mexico on July 29 2015 killed four men including a State of Coahuila government official.,1,0.0,1.0,4062
Please allow me to reiterate it's not the weapon it's the mindset of the individual! #professional #help! -LEGION! url,1,0.19820000000000004,0.8018,4063
url Twelve feared killed in Pakistani air ambulance helicopter crash url,1,0.0,1.0,4064
Severe Thunderstorm pictures from across the Mid-South url,1,0.0,1.0,4065
More women children casualties of Afghan violence url,1,0.0,1.0,4066
To All The Meat-Loving Feminists Of The World Riot... url #followme | url url,0,0.8059999999999999,0.19400000000000006,4067
Detonation fashionable mountaineering electronic watch water-resistant couples leisure tabU_ url url,0,1.0,0.0,4068
Fun. Hobby Lobby exploded in this home. url,0,0.8038,0.19620000000000004,4069
Hero's fight wars and save ppl from burning buildings etc I'm sorry but u gotta do more than pay 4 a sex change be4 I call u a hero,0,0.665,0.335,4070
Haley Lu Richardson Fights for Water in The Last Survivors (Review) url,0,0.8317,0.1683,4071
Indeed!! I am fully aware of that battle! I support you in that fight!!  url,1,0.3995,0.6005,4072
The only demolition 2 be done by Christians is the putting away or throwing out of the flesh & sin - personally. #IntheSpiritWeBuild 2gether,0,0.8,0.2,4073
