text,crowd_label,conf0,conf1,itemID
We all knew Cain wasn't going to die... It's either Val or someone is gonna collapse later on... #Emmerdale #SummerFate,1,0.19820000000000004,0.8018,1923
#3: Car Recorder ZeroEdgea  Dual-lens Car Camera Vehicle Traffic/Driving History/Accident Camcorder  Large Re... url,0,1.0,0.0,1924
mention your Tweet was quoted by mention  url,0,0.7958,0.20420000000000005,1925
Evacuate from your life.,0,0.8026,0.1974,1926
Tension In Bayelsa As Patience Jonathan Plans To Hijack APC PDP - The Sun: Plans by formerU_ url url,1,0.1948,0.8052,1927
This why BSF Jawans died Fidayeen has AKs and they bloody #INSAS! INSAS rifles not to blame for soldiers' deaths MoD url,1,0.1958,0.8042,1928
Governor allows parole for California school bus hijacker: Local... url url,1,0.0,1.0,1929
And last year it was just a lot of 'THE DRUMS ARE FLOODING' and 'JANICE I'M FALLING',0,0.7964,0.2036,1930
Tonight It's Going To Be Mayhem @ #4PlayThursdays. Everybody Free w/ Text. 1716 I ST NW (18+) url,0,1.0,0.0,1931
mention my trick is to think about nasty things,0,1.0,0.0,1932
MUST-SEE: Massive ISIS Suicide Truck Bombing Caught On Tape url via mention,1,0.0,1.0,1933
My head gonna explode soon,0,1.0,0.0,1934
#TheDoolingGroup 2 injured when 2 school buses collide - aE #BREAKING: School bus slams into school bus in Bordento... url,1,0.0,1.0,1935
Rocky fire in Northern California swells to 60000 acres; 12000 evacuated url Portland #Phoenix #Miami #Atlanta #Casper,1,0.0,1.0,1936
mention mention just order a blizzard pay then put your nuts in it say they have you ball flavored. Boom free ice cream,0,1.0,0.0,1937
New roof and hardy up..Windstorm inspection tomorrow url,0,0.8042,0.1958,1938
mention mention mention mention yeah we survived 9 seasons and 2 movies. Let's hope for the good. There's hope ??????,0,1.0,0.0,1939
RT mention Tanzania elephant population declined by 60% in five years census reveals url url,1,0.3947000000000001,0.6053,1940
Devastation: coming to a mention and find the mention closed ?? #momneedscoffee #asap #iwontmakeit,0,0.7994,0.2006,1941
mention Hi David in 2003 I saw the USA walk into a war that destroyed the lives of millions. You can prevent a repeat. #IranDeal,1,0.0,1.0,1942
Japan to mark 70th anniversary of Hiroshima atomic bombing url,1,0.1654,0.8346,1943
Not only does he know the latest research the kiddo's GI specialist sang the volcano number from Inside Out. Now THAT is whole person care.,1,0.3934,0.6066,1944
Driver rams car into Israeli soldiers wounds 3: military: A driver rammed a car into a group of Israeli soldi... url,1,0.0,1.0,1945
"Hurricane Dancers: The First Caribbean Pirate Shipwreck
Margarita Engle - Henry Holt and Co. (BYR). url",0,0.8024,0.1976,1946
mention poor white guy his mom made him pizza and he wanted mac n cheese so he blew up a school. Such a sad story.,0,1.0,0.0,1947
Smoke it all url,0,0.8015,0.1985,1948
Last Second OutBid RT? url 30pcs 12mm Ab Resin Flower Whirlwind Flatback Rhinestone Wedding Decoration ?Please Fa,0,0.7985,0.2015,1949
That horrible sinking feeling when youUave been at home on your phone for a while and you realise its been on 3G this whole time.,0,1.0,0.0,1950
OMG so last week i accidentally burned myself with a cigarette lol only i would do that,0,0.7981,0.2019,1951
"Jane Kelsey on the FIRE Economy
5th Aug 5:30UO7:30pm
Old Govt Buildings Wgton
The context & the driver for #TPP and #TRADEinSERVICESAgreement",0,0.8021,0.1979,1952
Rightways: Building structural integrity & failure: inspections damages defects testing  repair url via mention,1,0.3976,0.6024,1953
mention Every case for Yes has been utterly demolished utterly. If i was you IUad be embarrassed to bring up indy ever again.,0,1.0,0.0,1954
"LONER DIARIES.

The patterns  on the sand
May have been blown away.
The photos in twos
All choked up in flames.... url",0,0.8024,0.1976,1955
And here I was complaining about Phoenix Mode in Fire Emblem. Turns out Ray Gigant will have a 'difficulty' option where you take 0 damage.,0,0.8,0.2,1956
Damn bloody hot,0,0.797,0.203,1957
You made my mood go from shitty af to panicking af istg,0,1.0,0.0,1958
I had to grill for a school function. One of the grills we had going was pretty much either off or forest fire. No inbetween! Made it work,0,1.0,0.0,1959
Please pray for employees  residents and first responders.  #myhometown #livesmatter url,0,0.7988,0.20120000000000005,1960
Yessum I'm traumatised ??,0,1.0,0.0,1961
"It's okay I welcome the rain. 
Gave you all the storm that you could weather.",0,0.6006,0.3994,1962
mention what is double result live on the app?,0,0.8059999999999999,0.19400000000000006,1963
mention Zero damage just a horrible product,0,1.0,0.0,1964
Police officer wounded suspect dead after exchanging shots: RICHMOND Va. (AP) UO A Richmond police officer wa... url,1,0.3994,0.6006,1965
#Tajikistan #Mudslides #China aids to #Mudslide-hit #Tajiks url,1,0.0,1.0,1966
Want to meet mention Earn your way by watching mention #SurvivorsGuidetoEarth! #Incubustour2015 - url,0,1.0,0.0,1967
OUN continues Severe Thunderstorm Warning for Oklahoma [OK] till 10:30 PM CDT url,1,0.0,1.0,1968
mention - 'if you shred my Psych work our friendship would be annihilated',0,1.0,0.0,1969
"True strength is forgiveness. Love the most powerful weapon. .mention Broken Circle'

#giveaway #boyxboy url",0,1.0,0.0,1970
#ROH3 #JFB #TFB #alrasyid448ItuRasya Correction: Tent Collapse Story url ROH3 SmantiBatam #ROH3SmantiBatam,1,0.3958,0.6042,1971
One of these candidates is going to have a Frank Grimes level meltdown with how voters love Trump no matter what. url,0,1.0,0.0,1972
TRAIN ACCIDENT IN HARDA (M.P.) IS NOT NATURAL DISASTER. IT SHOWS FAILURE OF MINISTRY OF RAILWAY.PROPER CHECK AT FIXED INTERVAL IS NEEDED.,1,0.0,1.0,1973
Businesses are deluged with invoices. Make your. stand out with colour or shape and it's likely to rise to the top of che pay' pile.,0,1.0,0.0,1974
God the past few nights have been awesome but tonight it looks like the heat wave is back ?? can't breathe in my room!,1,0.3922,0.6078,1975
Deadly suicide bombing hits mosque in Saudi Arabia: A suicide bomber has blown himself up at a mosque in the s... url,1,0.0,1.0,1976
But the sea would..electrocute us all.,0,0.6024,0.3976,1977
mention Not tweeting and driving Joshua. Typos are hazardous.,0,1.0,0.0,1978
mention mention mention mention mention It's not pretty ??#disaster #GBBO #mudslide,1,0.0,1.0,1979
I JUST SCREAMED SIDJSJDJEKDJSKDJD . I CANT STAND YOU ?? url,0,1.0,0.0,1980
No Shane I'm sorry you are wrong. You were propagating that an all out attack would demolish England #reversal,1,0.19820000000000004,0.8018,1981
Christian Attacked by Muslims at the Temple Mount after Waving Israeli Flag via Pamela Geller - ... url,1,0.1946,0.8054,1982
Malaysia confirms Reunion Island debris is from MH370 url mention url,1,0.0,1.0,1983
Why are you engulfed by low self-image? Take the quiz: url url,0,1.0,0.0,1984
Christian Attacked by Muslims at the Temple Mount after Waving Israeli Flag via Pamela Geller - ... url,1,0.0,1.0,1985
mention mention My boyfriend wants too see mention too! #TwisterLovesShania ?????? url,0,1.0,0.0,1986
"Truth...
url
#News
#BBC
#CNN
#Islam
#Truth
#god
#ISIS
#terrorism
#Quran
#Lies url",1,0.19820000000000004,0.8018,1987
mention indeed and a remarkably puny idea to place at the epicentre of a new post-capitalism epoch,0,0.8317,0.1683,1988
Patriot Survival Guide: Do you know how survive when the governments collapse or other natural disaster happens? url,1,0.0,1.0,1989
EARTHQUAKE SAFETY LOS ANGELES UO SAFETY FASTENERS XrWn,0,0.6678,0.33220000000000005,1990
Last chance to work at the old FFA foodstand at the fairgrounds. We are finishing demolition at 9am.  Any help would be appreciated,0,0.6024,0.3976,1991
Rainstorm Destroys 600 Houses in Yobe State: Rainstorm Destroys 600 Houses in Yobe State. [Daily Trust] Damatu...  url,1,0.0,1.0,1992
mention you're too busy finishing those weapon designs,0,0.8021,0.1979,1993
Traffic Collision - Ambulance Enroute: Florin Rd at Franklin Blvd South Sac url,1,0.0,1.0,1994
mention My narrator will have to say 'chemically interesting lavatory' for DB5. Not quite the tongue twister but certainly odd. :P,0,0.8059999999999999,0.19400000000000006,1995
Watch This Airport Get Swallowed Up By A Sandstorm In Under A Minute url,1,0.0,1.0,1996
Two cranes restoring a bridge in the central Dutch town of Alphen aan den Rijn collapse on to buildings with rescuers searching for,1,0.0,1.0,1997
Hellfire is surrounded by desires so be careful and donUat let your desires control you! #Afterlife,0,1.0,0.0,1998
will there be another jocelyn birthday apocalypse,0,1.0,0.0,1999
Kurd Suicide Attack Kills 2 Turkish Soldiers url,1,0.0,1.0,2000
mention mention where you being electrocuted all the way round? The map sure looks like it.,0,0.797,0.203,2001
For those displaced by disasters label and legal status remain out of reach url,0,0.7127,0.2873,2002
Volunteers served first responders today during a tanker fire in Eufaula. Provided cold drinks and food. #okwx #tankerfire,1,0.0,1.0,2003
"Navy: No charges against officer for weapons violations in Chattanooga attack
 url",1,0.0,1.0,2004
I went to pick up my lunch today and the bartender was holding my change hostage because he wanted my number. ??,1,0.3943,0.6057,2005
mention Editor In Chief mention Releases Issue #7 url of #RAmag. #Fashion #Models and #Mayhem,0,1.0,0.0,2006
U.S National Park Services Tonto National Forest: Stop the Annihilation of the Salt River Wild Horse... url via mention,0,1.0,0.0,2007
11-Year-Old Boy Charged With Manslaughter of Toddler: Report: An 11-year-old boy has been charged with manslaughter over the fatal sh...,1,0.1976,0.8024,2008
Twelve feared killed in Pakistani air ambulance helicopter crash url,1,0.0,1.0,2009
Sharp rise in women children casualties in Afghan war UN says url url,1,0.20440000000000005,0.7956,2010
Rare photographs show the nightmare aftermath of #Hiroshima | #NoNukes #Amerikkka #WhiteTerrorism #Nuclear #Disaster  url,1,0.0,1.0,2011
mention GodsLove & #thankU my sister for RT of NEW VIDEO url The Coming Apocalyptic US Earthquake & Tsunami,1,0.19820000000000004,0.8018,2012
"Wreckage is MH370: Najib
url #MH370 #najibrazak #MalaysiaAirlines",1,0.0,1.0,2013
mention ok so no sirens but a speaker system for chip music for a food cart should be fine with underskirt lighting?,0,0.6018,0.3982,2014
The hatchet-wielding gunman had PEPPER SPRAY AND A FAKE BOMB?!?!?,1,0.0,1.0,2015
mention place out. It was ex Pars defender Andy Tod in full uniform. It was instant pandemonium. Utter mayhem ensued!,0,1.0,0.0,2016
one of them wild fires in cali or something or in the mid west or where ever they show up..shit dont pop up around me,1,0.0,1.0,2017
I don't get waves of missing you anymore... They're more like tsunami tides in my eyes,0,1.0,0.0,2018
News On 6 Crew Neighbors Put Out Hallett Truck Fire url url,1,0.0,1.0,2019
Flood and Mudslide Warning for East Fjords | Iceland Review url #icelandreview via mention,1,0.0,1.0,2020
Download @ iTunes url 'Floods Of Glory' by Luiz Santos #jazz #art #Music,0,1.0,0.0,2021
mention Be strong. It's at times like this that arson happens. Push thru past the felony stage.,0,0.7995,0.2005,2022
mention the ambulance isn't even parked well like its nearly on top of someone's car I'm laughing,0,1.0,0.0,2023
Isn't it ironic that on the anniversary of Hiroshima our current President is helping a terrorist nation acquire nuclear weapons. #TRAITOR,1,0.0,1.0,2024
Panic attacks are the worst ????,0,0.6006,0.3994,2025
Obama Declares Disaster for Typhoon-Devastated Saipan: Obama signs disaster declaration for Northern Marians a... url,1,0.0,1.0,2026
The City has activated the Municipal Emergency Plan. Primarily stay indoors avoid flooded areas Call 311 for... url,1,0.2036,0.7964,2027
Last Chance Animal Rescue has 3 new posts. url #animalrescue | url,0,1.0,0.0,2028
"She says that she'd love to come help but
The sea would....
Electrocute us all... ??????????",0,1.0,0.0,2029
mention mention mention mention The last 2 of 68 cities where everyone was burned to death. Terrorism on the grandest of scales,1,0.0,1.0,2030
#stormchase Violent Record Breaking EF-5 El Reno Oklahoma Tornado Nearly Runs Over ... - url url,1,0.1988,0.8012,2031
There is this old lady rockin out to death metal in her sedan downtown smoking a cigarette. I found my real mom.,0,1.0,0.0,2032
I added a video to a mention playlist url World Of Tanks - Battle Assistant Mod Bat Chat Arti kaboom,0,0.7988,0.20120000000000005,2033
Clev: Me? | You. Clev: Indeed. | Do you know what happened to ben? Clev: He drowned. | How. Clev: By his father. mention,0,1.0,0.0,2034
mention came through like a tornado and destroyed me. such beautiful words,0,1.0,0.0,2035
mention mention ! Instead of promoting false news first get your facts right . It was a road rage incident . Vehicles collided,1,0.19820000000000004,0.8018,2036
'It looks like a mudslide' poor thing! ?? #greatbritishbakeoff,1,0.3962,0.6038,2037
IJ: Texas Seeks Comment on Rules for Changes to Windstorm Insurer url,1,0.39399999999999996,0.606,2038
RT: Geek_Apocalypse: 4pm GMT :Hesse plays dark souls 2 day 9: url url #etcPB,0,1.0,0.0,2039
RT Saginaw - Police sketches of 2 'persons of interest' in Saginaw arson url url,1,0.2006,0.7994,2040
mention I promise not to tax pancakes or rainbows or not dying in a fire.,0,0.7140000000000001,0.2859999999999999,2041
Dracula Vampire Cross Body Small Shoulder Bag url,0,0.7994,0.2006,2042
mention I'm telling your mom your up past curfew oth,0,1.0,0.0,2043
This machine really captured my attention. #helicopter #firefighting #wildfire #oregon #easternoregonU_ url,1,0.0,1.0,2044
mention interested to see who will win this battle,0,0.7997,0.20030000000000006,2045
General News UaE'Demolition of houses on waterways begins at Achimota Mile 7 ' via mention Full story at url,1,0.20230000000000006,0.7977,2046
Robert Ballew's log statements are always at the FATAL level.,0,1.0,0.0,2047
You certainly are mention Great to see all you #HS2 astroturfers panicking at the thought of cross party support crumbling.,0,0.7982,0.2018,2048
Fuck  Neil go fall off a cliff or something.....#yr ??????,0,1.0,0.0,2049
mention Sorry for screaming at you and mention from the car I just kinda 'I KNOW THOSE PEOPLE LET'S YELL!' :/,0,1.0,0.0,2050
Seeing that army of whitewalkers was the very first thing that has slightly intrigued me on GoT so far,0,1.0,0.0,2051
Heat wave adding to the misery of internally-displaced Gazans url via mention url,1,0.0,1.0,2052
Are people not concerned that after #SLAB's obliteration in Scotland #Labour UK is ripping itself apart over #Labourleadership contest?,0,0.6051,0.3949,2053
Wildfire Burns On California U.s. China Economic Net U_ : url  url,1,0.0,1.0,2054
#?x?: :and to counter acts such as the burning of the Alexandrian library.,1,0.1988,0.8012,2055
< Suicide Bombing Of European Union Car Kills At Least Three In Kabul on url,1,0.2,0.8,2056
Downtown Emergency Service Center is hiring! #Chemical #Dependency Counselor or Intern in #Seattle apply now! #jobs url,0,0.7999,0.20009999999999994,2057
the Internet is sending subliminal messages about ice cream therefore I need a blizzard rn,0,1.0,0.0,2058
Escape The Heat (and the #ORShow) for a trail run on Desolation Loop you'll be glad you did url url,0,0.7958,0.20420000000000005,2059
Had an awesome time gettin wrecked at bowling last night! url,0,0.7994,0.2006,2060
mention mention i cant believe...is this d same stuart broad who was destroyed by our yuvi..????,0,0.7976,0.2024,2061
Party for Bestival crash victim Michael Molloy on what would have been his 21st url,1,0.1998,0.8002,2062
"Yr voice ws the soundtrack of my summer.Do u know u're unlike any other.U'll always be my thunder! ?
mention url",0,1.0,0.0,2063
I liked a mention video from mention url PokImon Omega Ruby and Alpha Sapphire Wi-Fi Battle #05 cjs064 vs,0,1.0,0.0,2064
#landslide while on a trip in #skardu url,0,0.8059999999999999,0.19400000000000006,2065
Two Films From Villanova University Students Selected As 2015 Student Academy Award Finalists: Lightning struckU_ url,0,0.8042,0.1958,2066
"Crawling in my skin
These wounds they will not hea",1,0.3943,0.6057,2067
mention The utopian impulse inevitably ends in gulags and mass murder.,1,0.3987000000000001,0.6013,2068
Ignition Knock (Detonation) Sensor-Senso Standard fits 03-08 Mazda 6 3.0L-V6 url url,0,0.8,0.2,2069
Some crazy lightning outside,0,0.6036,0.3964,2070
The United Kingdom and France are bombing Daesh in Syria - Voltaire Network url,1,0.0,1.0,2071
Another sad ocean casualty-Gray whale population in the Pacific listed as critically #endangered (#drone video) url .,1,0.39399999999999996,0.606,2072
"Truth...
url
#News
#BBC
#CNN
#Islam
#Truth
#god
#ISIS
#terrorism
#Quran
#Lies url",0,1.0,0.0,2073
Breakfast links: Work from home: Derailed: An empty train derailed at Smithsonian this morning suspending ser... url,1,0.0,1.0,2074
#porn #nsfw: Blacks attack for white married slut url,0,1.0,0.0,2075
UIStretcher in 5 min // Speaker DeckU url,0,1.0,0.0,2076
Apparently they're going to have a WW2 siren to announce something. Not sure if that's fun or dull bc the WW2 siren is a v monotonous sound.,0,0.7994,0.2006,2077
#Shipping #Logistics eNCA | Fatalities as migrant boat capsizes in Med with hundreds onboard: U_  capsized as i...  url,1,0.20120000000000005,0.7988,2078
mention  US Drone attack kills 4-suspected militants in North Waziristan mention url,1,0.1994,0.8006,2079
Obama Declares Disaster for Typhoon-Devastated Saipan: Obama signs disaster declaration for Northern Marians a... url,1,0.0,1.0,2080
mention mention mention mention mention mention mention mention mention mention After cyclone,1,0.0,1.0,2081
mention mention I'll bet I do,0,0.7982,0.2018,2082
"Me- Don't bother calling or texting me because my phone is obliterated

*has 7k missed calls and messages*",0,1.0,0.0,2083
mention listen to hurricane,1,0.20009999999999994,0.7999,2084
*screams internally*,0,1.0,0.0,2085
mention ESH PLEASE OKAY!,0,1.0,0.0,2086
mention  Pleas FOR global warming don't really work when California / Australia keep having catastrophic 'bush' fires.,1,0.0,1.0,2087
Want to sell my boat of a car for a truck,0,1.0,0.0,2088
Stepped outside with a drink and a cigarette and immediately locked eyes with a jogger. Worlds really do collide.,0,1.0,0.0,2089
Memorial day of 70 years Hiroshima and Nagasaki (69 august 1945) wth total casualties 200.000+ . God forgive them!,1,0.0,1.0,2090
#WWII #SGM T34 in flames but with tank of gasoline to the outside it is likely that the crew survive . url,1,0.2037,0.7963,2091
Newcastle: Schoolgirl attacked in Seaton Delaval park by 'pack of animals' led by a former friend url #newcastle,1,0.1988,0.8012,2092
url Jacksonville family bands together as memorial is planned for toddler who ... - FloridaU_ url,0,0.7964,0.2036,2093
I have the biggest girl crush on oomf ????,0,1.0,0.0,2094
Q: Why do ducks have big flat feet? A: To stamp out forest fires. Q: Why do elephants have big flat feet? A: To stamp out flaming ducks.,0,1.0,0.0,2095
mention Does that 'great Iran deal' cover bioterrorism? You got cut off terrible of them. Keep up the good work.,1,0.3964,0.6036,2096
earthquake drill atm,1,0.19820000000000004,0.8018,2097
"SCREAMING BECAUSE 5SOS IS IN TX
mention",0,0.6018,0.3982,2098
mention yes a lot more harm then good if there are guardrails up now why cant we go 50. Their will be a big problem when school starts,0,1.0,0.0,2099
samel_samel has a crush: url,0,1.0,0.0,2100
mention Trauma Center Shines In Response To Multi-Casualty Crash. url url,1,0.0,1.0,2101
mention I can see why one of your favorite books is 'Beautiful Disaster' it may now be one of mine??,0,1.0,0.0,2102
mention I know mention will be saying her final goodbyes to grandpa as seen on news RiP Me? always open to ideas but may ve curfew,0,1.0,0.0,2103
mention mention  it's so sad out there in BC all the wild fires. Hope u are safe.,1,0.19700000000000006,0.8029999999999999,2104
From mention Lean Thinking for Quicker Police Emergency Response Time url,0,1.0,0.0,2105
Reddit Will Now Quarantine Offensive Content >> url,1,0.20120000000000005,0.7988,2106
I liked a mention video url Lexi Belle for Oklahoma tornado victims,1,0.20120000000000005,0.7988,2107
On the Christie Hillside: Game 4 - Pandemonium at the Pits url mention mention url,0,1.0,0.0,2108
Sometimes logic gets drowned out in emotion but it's gotta surface at some point.,0,0.7994,0.2006,2109
Poor Jack ??,0,1.0,0.0,2110
"Trafford Centre film fans angry after Odeon cinema evacuated following false fire alarm: 
 Twi... url #manchesterlite",1,0.1946,0.8054,2111
I will only call or text 2 niggas my bff & my boyfriend ???? I love my boys to death. No other niggas can hold my attention like them ??,0,0.7982,0.2018,2112
Hail:The user summons a hailstorm lasting five turns. It damages all Pokemon except the Ice type.,0,1.0,0.0,2113
Sitting around a fire sounds great right about now,0,1.0,0.0,2114
mention Editor In Chief mention Releases Issue #7 url of #RAmag. #Fashion #Models and #Mayhem,0,1.0,0.0,2115
'Money can't buy happiness' is just a lie we tell poor people to keep them from rioting.,1,0.19510000000000005,0.8049,2116
AmazonDeals: Skylanders Trap Team: Flip Wreck Character Pack - down 4.53% ($0.45) to $9.49 from $9.94 #Sale url,0,1.0,0.0,2117
Twitter is going to be a war zone today  url,0,1.0,0.0,2118
AMBULANCE SPRINTER AUTOMATIC FRONTLINE VEHICLE CHOICE OF 14 LEZ COMPLIANT | eBay url,0,0.7987,0.20130000000000006,2119
Southeast Dirt Riot Series Crowns Champions:  Southeast Dirt Riot Series Crowns ChampionsBLACKFOOT ID: The So... url,0,1.0,0.0,2120
If John Bateman scores we riot... url,0,0.6018,0.3982,2121
Woke up so blown lol,0,1.0,0.0,2122
Pandemonium In Aba As Woman Delivers Baby Without Face (Photos) - url,0,1.0,0.0,2123
Do you guys remember my life goal to smoke a blunt with zouis? Well it's still a goal,0,0.7988,0.20120000000000005,2124
Afghan conflict sees 'sharp rise' in female casualties url url,1,0.0,1.0,2125
'Amateur Night' Actress Reprises Role for 'Siren' - HorrorMovies.ca #horror url,1,0.3943,0.6057,2126
mention thank you. ?? now I don't have a city wide curfew. ????,0,1.0,0.0,2127
"RT mention mention 
The man who survived Hiroshima: 'I had entered a living hell on earth' url",1,0.0,1.0,2128
Im going to obliterate my lil bro in 2k15 either with the Cavaliers or 70-71 Lakers,0,0.7964,0.2036,2129
The day of death destruction chaos; 60000 to 80000 people were killed instantly. Please take sometime to remember and think about others,1,0.0,1.0,2130
mention ight,0,1.0,0.0,2131
UD: Rescue (Structural Collapse) - Scott Road @ Ypres Road York (14 Trucks),1,0.19820000000000004,0.8018,2132
Good olde fashioned prairie #hailstorm #calgaryweather url,1,0.19910000000000005,0.8009,2133
Investigators say a fatal Virgin Galactic spaceship crash last year was caused by structural failure after the coU_,1,0.0,1.0,2134
desolation #bored,1,0.3916,0.6084,2135
Aurora Prediction: Kp: 3.33(11:16) 4.67(14:16) AK (earth 2.00) 75% Status: Low Storm,0,0.67,0.33,2136
.POTUS #StrategicPatience is a strategy for #Genocide; refugees; IDP Internally displaced people; horror; etc. url,1,0.0,1.0,2137
I feel like that episode of Victorious when they all got trapped in an RV and almost died of heat stroke #MTVHottest One Direction,0,0.6018,0.3982,2138
The Latest: Washington #Wildfire misses town; evacuations end - KHQ Right Now url,1,0.0,1.0,2139
New #photo Oak in a snowstorm url taken in #winter on the #SouthDowns #Hampshire #photography #art #tree #treeporn,1,0.0,1.0,2140
I'm about to be obliterated,0,1.0,0.0,2141
mention I agree! I didn't know you had moved to Marketplace. I woke up to your report & thought my favorite worlds (BOL-APM) collided.,0,1.0,0.0,2142
Ashes 2015: AustraliaUas collapse at Trent Bridge among worst in history: England bundled out Australia for 60 ... url,0,0.6033,0.3967000000000001,2143
ChinaUas e-commerce firms Alibaba (BABA) Tencent url (JD) are still growing revenue at 40% url,1,0.19530000000000008,0.8047,2144
Killing Black Babies at Planned Parenthood where's the demonstrations looting of PP burning down the buildings Black Babies Lives Matter,1,0.3976,0.6024,2145
#Sismo M 1.9 - 5km S of Volcano Hawaii: Time2015-08-06 01:04:01 UTC2015-08-05 15:04:01 -10:00 at epicente... url #CS,1,0.0,1.0,2146
"A mended finger
When a finger is cut there is an immediate reaction from the bodyUas emergency services occurs:
U... url",0,0.7986,0.2014,2147
mention there are now 5 fire trucks and 2 ambulances at Wellington ridge lp in Cary. one of the units is on fire. not sure on injuries,1,0.0,1.0,2148
Municipal Emergency Plan deactivated! Crisis averted.  url,0,0.6583,0.3417,2149
'Car vs motorcycle in Harwich Port' HARWICH PORT UO A car and motorcycle collided around 5:30 p.m. The crash happenU_ url,1,0.0,1.0,2150
Missing Malaysian airplane: Debris was planted UO Families News - WhirlWind News url,1,0.0,1.0,2151
the road to success is paved with pennies that I flattened on the train tracks you're welcome.,0,1.0,0.0,2152
Lately I've been under pressure make me wanna put a fuck niqqa on a stretcher,0,0.8,0.2,2153
What scenes at Trent Bridge England could win the #Ashes today at this rate! #Pandemonium,0,1.0,0.0,2154
mention shares how to handle the heat and keep your cool url  #facilitiesmanagement,1,0.1977,0.8023,2155
LOL Warthen in the midst of bullpen meltdown reaching for Double Bubble. #Mets,0,0.8024,0.1976,2156
Governor weighs parole for California school bus hijacker url url,0,0.8024,0.1976,2157
"mention mention 
Never dies a big Crime like RABAA MASSACRE as long the revolution is being observed.
#rememberRABAA",1,0.0,1.0,2158
Man united is not just about playing football like he did back at Spain its about passion courage and endurance to ride the storm.,0,1.0,0.0,2159
