text,crowd_label,conf0,conf1,itemID
url Reddit's new content policy goes into effect many horrible subreddits banned or quarantined url,0,0.7994,0.2006,1
RT mention #NWS issues Severe #Thunderstorm Warnings for parts of #AR #NC #OK. Expect more trauma cases: url,1,0.0,1.0,2
mention Verrry mad. like I just screamed I'm so pissed,0,1.0,0.0,3
This the same dude that obliterated meek mill. Dont judge a book by its cover. url,0,1.0,0.0,4
Dem FLATLINERS who destroy creativity-balance-longevity & TRUTH stand with Lucifer in all his flames of destruction url,1,0.3964,0.6036,5
the bitches say im hot i say no bitch im blazing,0,1.0,0.0,6
mention I see people are panicking about Orpik all over again.,0,0.8018,0.19820000000000004,7
Heat Advisory is In Effect From 1 PM Through 7 PM Thursday. A Building Heat Wave and Increasing Humidity... #lawx url,1,0.1663,0.8337,8
Learn cPanel in 2015. Join cPanel Crash Course only $20 url,0,1.0,0.0,9
Ted Cruz fires back at Jeb & Bush: UIWe lose because of Republicans like Jeb & Mitt.U [Video] -  url,0,1.0,0.0,10
(AR)  Severe Thunderstorm Warning issued August 05 at 9:12PM CDT until August 05 at 9:45PM CDT by NWS url #arwx,1,0.1983000000000001,0.8017,11
Solitude Fire Update August 6 2015 (Solitude Wildfire): Summary: This lightning-caused fire is being ... url #UTFire,1,0.0,1.0,12
Weak but distinct rotation fully condenses near Villa Ridge MO today near MCV center.  A 'sub-tornado?' Video: url,1,0.1976,0.8024,13
mention Yeah I don't think he's elite either I think Hazard is the better player too. But not by much,0,0.7969,0.20309999999999995,14
?? New Ladies Shoulder Tote #Handbag Faux Leather Hobo Purse Cross Body Bag #Womens url url,0,0.7956,0.20440000000000005,15
Philadelphia EaglesUa Jordan Matthews Is Going To Explode In 2015 url #news #hotnewscake,0,1.0,0.0,16
mention If 90BLKs&8WHTs colluded 2 take WHT F mention AUTH Hostage&2 make her look BLK w/Bioterrorism&use her lgl/org IDis ID still hers?,1,0.397,0.603,17
"OMG OMG OMG #JustinBieber and #HarryStyles have collided in a nuclear accident at #Cern ^oo^

#HarryBeCareful url",0,0.7982,0.2018,18
'Food crematoria' provoke outrage amid crisis famine memories... url,1,0.0,1.0,19
Some Evansville residents told to limit water usage due to sinkhole construction url,1,0.397,0.603,20
RT PemantauJKT48: China's Stock Market Crash: Are There Gems In The Rubble? url via melodyJKTU_ url,0,0.8553,0.14470000000000005,21
People are bagging on Rousey's body? Shit I'd love to have a body like that. Those who are ridiculing her are probably dudes in skinny jeans,0,0.8018,0.19820000000000004,22
Hellfire is surrounded by desires so be careful and donUat let your desires control you! #Afterlife,0,1.0,0.0,23
Just got evacuated from the movie theatre for an emergency. Saw people running from another they're.,1,0.0,1.0,24
First Time Playing Hearthstone on PC Thoughts url,0,1.0,0.0,25
mention I will watch your dub again it will be 100 % again ???? I also have other 3 ..will use one weapon today :p,0,1.0,0.0,26
'Why am I being constantly electrocuted?' 'I don't know. Are you by chance standing next to a cactus?'#Borderlands #Borderlands2 #OOCVG #FTW,0,0.8,0.2,27
The satisfaction of knowing you flattened someone with logic and reasoned argument ??,0,1.0,0.0,28
mention Torrecilla We Always info the Secret on LoL Game Check the Secret to get 600.000 Riot Points on my Bio,0,1.0,0.0,29
mention mention RED THUNDER AND BLONDE LIGHTNING BACK IN ACTION??????,0,1.0,0.0,30
mention sure the purdies will be alive with the blight ??,0,1.0,0.0,31
Punjab government flood relief platform: url realtime information on inundation damages rescue efforts & travel alerts,1,0.0,1.0,32
mention mention OMG I remember the meltdown the day I did her hair like ELSA and not ANNA.... OHHHH THE HORROR!!! LOL #tangletalk,0,1.0,0.0,33
mention Bore him with minutiae serve bad champagne. He may just explode.,0,1.0,0.0,34
When high fashion and food collide: Gucci has chosen one of ShanghaiUas most popular commercial avenue... url #fashion,0,1.0,0.0,35
Cutting for some celebrety and then posting the wounds online is a no-go.,0,1.0,0.0,36
that new lil b x chance is nothing but flames,0,0.8,0.2,37
Attack on Titan game on PS Vita yay! Can't wait for 2016,0,1.0,0.0,38
16 dead in Russia bus accident: At least 16 people were killed and 26 others injured when two buses collided i... url,1,0.0,1.0,39
I-90 Vantage: Backups eastbound with low visibility due to a dust storm about 4 miles east of the bridge.,1,0.0,1.0,40
This #Nursing #job might be a great fit for you: RN Nurse Shift Manager Emergency Services - Full Time... - url #Hiring,0,0.603,0.397,41
Wow social media really blew up after the shania twain concert,0,1.0,0.0,42
Oil and Gas Exploration Takes Seismic Shift in Gabon to Somalia - Bloomberg url #??????? #Somalia,1,0.3958,0.6042,43
Season 3 of New Girl was such a emotional train wreck I just wanted to cry laugh and eat a lot of ice cream,0,0.7974,0.2026,44
Sometimes you face difficulties not because you're doing something wrong but because you're doing something right. - Joel Osteen,0,1.0,0.0,45
To fight bioterrorism sir.,0,0.8004,0.1996,46
We're #hiring! Read about our latest #job opening here: RN Nurse Shift Manager Emergency Services - Full time... - url,0,0.83,0.17000000000000004,47
The Latest: More Homes Razed by Northern California Wildfire - ABC News url,1,0.0,1.0,48
mention *stands there engulfed in the fire smiling*,0,0.6024,0.3976,49
New warning for Central Hills 1' hail 60 mph winds. NOT affecting Sturgis but could later tonight. #KOTAWeather url,1,0.2018,0.7982,50
Sorrower  - Fresh Wounds Over Old Scars  (2015 Death Metal) url url,1,0.3964,0.6036,51
mention we like big hail and we cannot lie!! #SirMixAlot,0,0.8,0.2,52
Thunderstorms with little rain expected in Central California. High fire danger. #weather #cawx url,1,0.0,1.0,53
I liked a mention video from mention url Minecraft Skywars - O BLAZE QUE USA HACK E FLECHADAS SINISTRAS!,0,1.0,0.0,54
13 reasons why we love women in the military   - lulgzimbestpicts url url,0,1.0,0.0,55
#InsaneLimits #plugin enabled  mention    =TPS= | TDM | 400T | HARDCORE | LOCKER | WEAPON RULES' using 3 limits,0,1.0,0.0,56
Anyone know if Fox UINewsU will be live-streaming tonightUas Republican debate online? I want to watch the train wreck.,0,1.0,0.0,57
Chemical spill at a house in Hammondville. Emergency services attending. #BreakingNews #7News url,1,0.0,1.0,58
Greer man dies in wreck url,1,0.0,1.0,59
Men escape car engulfed in flames in Parley's Canyon crews investigating cause - url url,1,0.0,1.0,60
mention I hope you fall off a cliff,0,1.0,0.0,61
Does the opening scene of Harry Potter and the Order of the Phoenix remind anyone else of the movie Twister? Just me? Okay,0,1.0,0.0,62
And all you girls that smoke.... have you notice that you started to lose ALOT OF WEIGHT ??? HMMM Don't know body want no thin girl tf,0,0.8304,0.16959999999999995,63
raleigh cyclone 15 gear mountain bike 26'': url #sportinggoods url,0,1.0,0.0,64
I will never support looting or the burning of buildings but when seeing the people fight back against the police. I was proud,1,0.3916,0.6084,65
Morganite Gemstone White Fire Opal 925 Sterling Silver Ring Size 6 R1354 url url,0,1.0,0.0,66
What if the fire up in the Catalinas gets worse and we have to evacuate the area. Aka no school tomorrow,1,0.0,1.0,67
I'm incredibly sad & heartbroken so I'm just going to drown my sorrows in food & watch tv all night ?? url,0,1.0,0.0,68
Renewing Your Kitchen Cabinets for $100 url url,1,0.3994,0.6006,69
Families to sue over Legionnaires: More than 40 families affected by the fatal outbreak of Legionnaires' disea... url,1,0.0,1.0,70
mention mention mention mention  No burning buildings and rob during a riot. That's embarrassing & ruining this nation.,1,0.3916,0.6084,71
I don't pray harm on members of ISIS.I pray they experience the life-rebooting love of God & become 'Paul's' in Gods mind-blowing final Act,0,0.6692,0.3308,72
BE CAREFUL anyone who lives west of Beaverton. Forest Grove has a rapidly spreading fire heading east,1,0.0,1.0,73
i need u to delete this before i start crying into my computer and electrocute myself url,0,1.0,0.0,74
And then I go a ruin it all with something awful... #minions url,0,1.0,0.0,75
#LukeBox something about first responders/ military they are our true Hero's!! Besides your music,0,0.7976,0.2024,76
Housing Starts Explode to NewaEHeights url url,0,1.0,0.0,77
mention mention mention It said they had superficial wounds and it was the pepper spray that did the most damage.,1,0.3946,0.6054,78
To All The Meat-Loving Feminists Of The World Riot Grill Has Arrived: Pop quiz! Which do you prefer: feminist... url,0,1.0,0.0,79
New-born piglet running down a national speed limit road is rescued #oink #Dorset url url,0,1.0,0.0,80
This is why you should be burned at the stake ! url,1,0.1999,0.8001,81
mention    ..i have lava iris 3G 402,0,1.0,0.0,82
Photoshop CS6 Crash Course url #course url,0,1.0,0.0,83
Investigators rule catastrophic structural failure resulted in 2014 Virg.. Related Articles: url,1,0.2008,0.7992,84
mention mention D: What? That's a tragedy. You have a wonderful nose,0,0.7994,0.2006,85
"NONSENSE >> famine memories  -- strong exaggeration of Ukrainian MSM
#ukraine #russia #?????????? #sanctions url",1,0.1976,0.8024,86
Hellfire is surrounded by desires so be careful and donUat let your desires control you! #Afterlife,1,0.1994,0.8006,87
Photo: deadgirltalking: unfortunemelody: jaylenejoybeligan: tarynel: dredougie: santanico-pandemonium:... url,0,1.0,0.0,88
The cryptic words that guided pilots on the Hiroshima bombing mission url,1,0.20009999999999994,0.7999,89
Despite past devastation fortunately #forgiveness mutual #respect and #peace emerged.  #Remember #Hiroshima and #Nagasaki,1,0.20420000000000005,0.7958,90
Why put out a fire that's still burning?,0,1.0,0.0,91
Mark your Calendars: Fire truck parade returns to Raleigh! url,0,0.6024,0.3976,92
Large sinkhole swallows entire pond in Lowndes County Georgia: Large sinkholeU_ url #Occasion2B,1,0.2006,0.7994,93
mention mention Just cos Germany invaded Poland Japan bombed Pearl Harbor PRE-EMPTIVE SUICIDE url,1,0.19700000000000006,0.8029999999999999,94
*NEW* Snap On Tools Black baseball Hat/Cap Silver/Gray Embroidered S Logo Flames - Full reU_ url url,0,1.0,0.0,95
mention got it last month when I went into the EE shop. Glad it hasn't blown up yet. url,0,1.0,0.0,96
'Trust us to get rescued by the dopey ones!' Val is hilarious shame she's probably going to die #emmerdale,0,0.8012,0.1988,97
We gone get it  get it in blood,0,0.7985,0.2015,98
#??? #?? #??? #??? MH370: Aircraft debris found on La Reunion is from missing Malaysia Airlines ...  url,1,0.0,1.0,99
the mv should just be them strutting like they mean it while buildings are burning up in the bg and flames everywhere how cool would that be,1,0.3994,0.6006,100
"Militants attack police post in Udhampur; 2 SPOs injured

Suspected militants Thursday  attacked a police post in... url",1,0.3994,0.6006,101
The Prophet (peace be upon him) said 'Save yourself from Hellfire even if it is by giving half a date in charity.',0,0.6018,0.3982,102
Grass fire near Forest Grove contained. Sparked by a rock being struck by a tractor. #LiveOnK2 mention url,1,0.2018,0.7982,103
Wow bro blew up quick. Believe it or not he's this funny and clever in person at all times. You be like 'where... url,0,1.0,0.0,104
Full Episode:  WN 08/02/15: California Wild Fires Force 12000 to Evacuate #Worldnews url,1,0.0,1.0,105
Truck fire clogs canyon road url,1,0.0,1.0,106
#Myanmar  Displaced #Rohingya at #Sittwe point of no return url  #Prison like conditions #genocide IHHen MSF Refugees,1,0.1441,0.8559,107
reaad/ plsss 12000 Nigerian refugees repatriated from Cameroon,1,0.0,1.0,108
#foodscare #offers2go #NestleIndia slips into loss after #Magginoodle #ban unsafe and hazardous for #humanconsumption,1,0.0,1.0,109
Still and Box alarm for the train derailment at 61st and Calumet struck out on the orders of 2-1-21. #ChicagoScanner,1,0.0,1.0,110
Red Tropical Cyclone alert for SOUDELOR-15 in China Northern Mariana Islands 06 Aug 2015 06:00 UTC url,1,0.0,1.0,111
Bleachers' entire set has been one big game of The Stage Is Lava url,0,0.7996,0.2004,112
Saipan has no water electricity in aftermath of typhoon url,1,0.0,1.0,113
Traffic accident N CABRILLO HWY/MAGELLAN AV MIR (08/06/15 11:03:58),1,0.0,1.0,114
USGS EQ: M 0.6 - 8km SSW of Anza California: Time2015-08-06 01:26:24 UTC2015-08-05 18:26:24 -07:0... url #EarthQuake,1,0.19820000000000004,0.8018,115
mention mention worst feel in DS when u panicking during  boss fight and you chug two estus and the boss kills you while u drink,0,0.7988,0.20120000000000005,116
#NowPlaying * Cliff Richard - I Could Easily Fall (In Love With You) (& Shadows) * #Internet #Nieuws #Radio On url,0,1.0,0.0,117
2 Policemen receive bullet wounds Reports indicate 6-7 armed men attacked a police post.,1,0.0,1.0,118
How the West was burned: Thousands of wildfires ablaze in #California alone url #climate #energy url,1,0.0,1.0,119
Investigators rule catastrophic structural failure resulted in 2014 ... url,1,0.2006,0.7994,120
US Navy Sidelines 3 Newest Subs url,0,1.0,0.0,121
mention stunningly poor defense it's not all on the pitcher. If our bats are MIA like the top of 1st inning this team is in trouble.,0,1.0,0.0,122
Listen to Landslide by Oh Wonder #SoundCloud url,0,1.0,0.0,123
i still don't see the point of a frozen sequel like where's the wreck it ralph sequel,0,0.8042,0.1958,124
*screams internally*,0,1.0,0.0,125
BUT I will be uploading these videos ASAP so you guys get to see the new weapon types in action!,0,1.0,0.0,126
Tension In Bayelsa As Patience Jonathan Plans To Hijack APC PDP url url,1,0.2018,0.7982,127
'The harder the conflict the more glorious the triumph.' Thomas Paine,0,1.0,0.0,128
"Check out my Lightroom collection UIJordyne Sr Photos Lincoln Hay Col SunkU:
more of the results from Sunday

url",0,0.8556,0.14439999999999995,129
Photo: theonion: Rescuers Heroically Help Beached Garbage Back Into OceanaE url,0,0.6022,0.3978,130
#?? #?? #??? #??? MH370: Aircraft debris found on La Reunion is from missing Malaysia Airlines ...  url,1,0.203,0.797,131
(#TeambrianMundial) Hollywood Movie About Trapped Miners Released in Chile: 'The 33' Holly... url (#TeambrianMundial),1,0.1976,0.8024,132
mention For the people who died in Human Experiments by Unit 731 of Japanese military url url,1,0.0,1.0,133
Any disaster impairs mental health especially in vulnerable individuals... url,1,0.0,1.0,134
Sex Workers Say Credit Card Bans On Online Ads Do More Harm Than Good url,0,1.0,0.0,135
-honey you ain't no angel. You like to scream these words as a weapon. Well go ahead take your best shot woman. I wanna leave you it's,0,0.7982,0.2018,136
mention mention mention mention mention You must've got in trouble ??that's why you have #Fartanxiety now????,0,0.6006,0.3994,137
mention make natural disaster reporting more interesting by adding 'The' to headlines such as 'Rescuers are sifting through the wreckage',0,0.7958,0.20420000000000005,138
A subcontractor working for French seismic survey group CGG has been kidnapped in Cairo and is held by Islamic State the company said on WU_,1,0.0,1.0,139
Businesses are deluged with invzices. Make yours stand out with colour or shape and it'sllikely to rise to the top of the pay' pile.,0,0.8,0.2,140
Please sign & RT to save #SaltRiverWildHorses url url,1,0.2006,0.7994,141
I can't believe it never occurred to me that I could *not* be deluged with Kickstarter emails.,0,0.8059999999999999,0.19400000000000006,142
He came to a land which was engulfed in tribal war and turned it into a land of peace i.e. Madinah. #ProphetMuhammad #islam,0,1.0,0.0,143
SCREAMING mention mention url,0,1.0,0.0,144
#hot  Reddit's new content policy goes into effect many horrible subreddits banned or quarantined url #prebreak #best,0,0.8291,0.17090000000000005,145
Russian 'food crematoria' provoke outrage amid crisis famine memories url via mention,1,0.0,1.0,146
Lightning strike in the distance via /r/pics url #pics url,1,0.3963,0.6037,147
Free Ebay Sniping RT? url Lumbar Extender Back Stretcher Excellent Condition!! ?Please Favorite & Share,0,1.0,0.0,148
DISASTER AVERTED: Police kill gunman with Uhoax deviceUa ataEcinema url,0,0.6004,0.3996,149
mention If the word 'violent' comes to mind it's food poisoning. Nothing you can do but weather the storm about 24 hours.  :(,1,0.0,1.0,150
Today was trauma on top of trauma on top of  trauma in Richmond so I know work is going to be crazy the next two days,0,0.8,0.2,151
"#Muslim cemetery demolition infuriates cultural groups in #Israel 

url",1,0.2,0.8,152
The Catastrophic Effects of Hiroshima and Nagasaki Atomic Bombings Still Being Felt Today url,1,0.0,1.0,153
Pakistan Supreme Court endorses military courts for terrorism cases url,1,0.0,1.0,154
God damn it!!! I electrocuted myself ??,0,0.6018,0.3982,155
Two giant cranes holding a bridge collapse into nearby homes url,1,0.0,1.0,156
.mention mention mention mention that car crash was pretty fun to film  #melissaandjoeychat,0,0.7988,0.20120000000000005,157
What a win by Kerry. 7-16..... #obliteration,0,1.0,0.0,158
burned 163 calories doing 30 minutes of Total Body Cardio #21dayfix #myfitnesspal,0,1.0,0.0,159
chickmt123: #letsFootball #atk WIRED : Reddit will now quarantine offensive content url (url url,1,0.3973,0.6027,160
'An 18-wheeler came along and struck the fire truck spinning it around 180 degrees and causing it to roll over' url,1,0.0,1.0,161
I almost sent my coworker nudes on accident thank god for airplane mode,0,1.0,0.0,162
whO'S THAT SHADOW HOLDIN ME HOSTAGE I'VE BEEN HERE FOR DAYS,0,0.7969,0.20309999999999995,163
local family displaced by fire url via mention  Lets help that family out please,1,0.0,1.0,164
"Messi: has tattoos so he can't donate blood
Ronaldo: runs into burning buildings to save dogs #respect",1,0.3994,0.6006,165
RT to ruin mention 's day.  url,0,0.7999,0.20009999999999994,166
#360WiseNews : China's Stock Market Crash: Are There Gems In The Rubble? url,1,0.3936,0.6064,167
Apparently part of the building just collapsed. Hope everyone is ok.,1,0.0,1.0,168
Governor Allows Parole for School Bus Hijacker url,1,0.3967000000000001,0.6033,169
mention & mention make significant discovery in the North Sea: Visualise the full potential on our seismic     #g url,1,0.3934,0.6066,170
1970 Mercury Cyclone GT Hood Moulding Very NICE CORE Cobra Jet 429CJ GT url url,0,0.8024,0.1976,171
mention mention mention call,0,0.6591,0.3409,172
Now Trending in Nigeria: Police charge traditional ruler others with informantUas  murder url,0,1.0,0.0,173
mention I think of that every time I go to the epicentre haha,0,0.8,0.2,174
CLIMATE CONSEQUENCES: U.S. Forest Service Says Spending More Than Half Of Budget On Fires url url,1,0.397,0.603,175
mention Bharat is showing silent political upheaval and change to fulfill the wishes of the people. Retired DGM NABARD,0,1.0,0.0,176
RT mention #Love #TrueLove #romance lith  #Voodoo #seduction #Astrology #RTRRT #LOTZ 9-11 #apocalypse #Armageddon #1008plaU_,0,1.0,0.0,177
Udhampur terror attack: Militants attack police post 2 SPOs injured: Suspected militants tonight attacked a p... url,1,0.19820000000000004,0.8018,178
Driver fatalities down on Irish roads but pedestrians and cyclists at more risk url,1,0.32830000000000004,0.6717,179
He was being super bitchy yesterday (cause he felt like pop) and when he's bitchy him and Perla don't play and then Perla is devastated,0,1.0,0.0,180
Typhoon Soudelor approaches after 7 killed 2 missing in floods in Philippines url via mention,1,0.0,1.0,181
Swansea Uplot hijack transfer move for Southampton target Virgil van DijkUa url,1,0.2006,0.7994,182
mention mention FUCKING SCREAMING !,0,0.7952,0.2048,183
mention mention All the loves be screaming at this one ??????,0,0.8325,0.16749999999999998,184
What person would possibly make a horror film about the Isla Vista massacre in order to make money off of our tragedy?,1,0.0,1.0,185
Malaysia Airlines Flight 370 that Disappeared 17months ago Debris Found South of The Indian Ocean - url,1,0.0,1.0,186
rgj: Truck trailer catches fire in Reno url,1,0.0,1.0,187
MORE-->OSHA officers on siteinvestigating Noranda explosion -KFVS12 News Cape Girardeau Carbondale Poplar Bluff url,1,0.0,1.0,188
Why tf did I decide to workout today? My body feels like it's been engulfed by a mass of fiery disdain.,0,1.0,0.0,189
Thank you so so much to everyone for posting the rain and hail outside ... I had no idea guys ????????,0,0.7084,0.2916,190
That day remember the nuclear weapon power......Hiroshima 70th,1,0.1964,0.8036,191
mention I do It just seemed like the pages were out of order,0,1.0,0.0,192
When you say call dad but your phone dials emergency services..... #awesomejobsiri,0,1.0,0.0,193
New Explosion-proof Tempered Glass Screen Protector Film for Blackberry Z10 - Full read byU_ url url,0,1.0,0.0,194
Kai Forbath just demolished a weather station set up on a drill field with a missed field goal. Thing just exploded into metal bits.,1,0.3952,0.6048,195
RCMP confirm fatalities in two-vehicle crash: TCH remains closed at Whitbourne due to accident url,1,0.0,1.0,196
mention  He's already done it by negotiating with the #1 state of terrorism in the World. What was his hurry in trying to get a deal,1,0.1976,0.8024,197
mention let me report it to u people instead Mr.Obama just declares CNMI federal disaster area post typhoon soudelor. U guys 2slow2report.,1,0.2048,0.7952,198
Anyone else think that Stephen sounds like Andy Dick when he gets excited? The difference being... I actually like Stephen. #MasterChef,0,1.0,0.0,199
Ngata on injury list at start of practice for Lions url,0,1.0,0.0,200
mention mention mention Glononium 6C also helps with being blown up while bashing a bottle of nitroglycerin against a book.,0,0.6008,0.3992,201
Refugees as citizens - The Hindu url,0,0.6617,0.33830000000000005,202
UImention 'My friend came to school blasted...i asked him if he was high he said pancakes then collapsed' -Iowa City HighU,0,1.0,0.0,203
when your moms being annoying so you turn your beats pill all the way up to drown her out.,0,1.0,0.0,204
At this moment 70 years ago (local time) the 'Little Boy' atomic bomb exploded over Hiroshima instantly killing at least 70-80000 people.,1,0.0,1.0,205
Going to a fest? Bring swimming goggles for the dust storm in the circle pit,1,0.3994,0.6006,206
Every time I feel a new pain or strain in my body I panic because I need it for my career ??,0,1.0,0.0,207
#Kids going to #school amidst the #desolation of an #earthquake #aftermath #Love #OlympusU_ url,1,0.0,1.0,208
Suicide bomber detonates in Saudi Arabia mosque 17 reportedly killed url,1,0.0,1.0,209
Yeah it actually is this whole week we in a heat wave :( url,1,0.2008,0.7992,210
#np agalloch - the desolation song,0,1.0,0.0,211
Obama Declares Disaster for Typhoon-Devastated Saipan: Obama signs disaster declaration for Northern Marians after typhoon hits US territory,1,0.0,1.0,212
FedEx no longer to transport bioterror germs in wake of anthrax lab mishaps url,1,0.1976,0.8024,213
#hot  Reddit's new content policy goes into effect many horrible subreddits banned or quarantined url #prebreak #best,1,0.3964,0.6036,214
Perhaps 'historic' should be applied not to the deluge of recently exposed #ChildSexAbuse but the truly 'historic' scale of the cover-up,1,0.0,1.0,215
Biggest security update in history coming up: Google patches Android hijack bug Stagefright url,1,0.2025,0.7975,216
mention I'd rather have an ass in fire. At least I'd know whatever I eat will evacuate. Heartburn sticks around.,0,0.6005,0.3995,217
We're about to demolish the other team right after we eat this pizza. We don't need no fitness- Ashton Irwin #MTVHottest 5SOS #5sosquotes,0,0.7952,0.2048,218
UK police link Tunisian beach massacre with Bardo museum attack url,1,0.0,1.0,219
Do you feel deluged by unhappiness? Take the quiz: url url,0,0.7982,0.2018,220
(Also I dont think sewing thought a leather belt would work out that well lol),0,0.8059999999999999,0.19400000000000006,221
Media stocks are getting destroyed (DIS FOXA CMCSA SNI AMCX VIAB VIA TWX) url,0,1.0,0.0,222
via mention Hundreds feared drowned as migrant boat capsizes off Libya url #UFO4UBlogEurope,1,0.1964,0.8036,223
Womens Cross Body Messengers Bags Clutch Small Shoulders Zippers Bags White url url,0,0.797,0.203,224
TTW Today's News: Bin Laden family plane crashed after 'avoiding microlight and landing too far down runway'  url,1,0.0,1.0,225
I really demolished it,0,0.797,0.203,226
70 Years After Atomic Bombs Japan Still Struggles With War Past: The anniversary of the devastation wrought b... url,1,0.0,1.0,227
Talk on GOZ is fantastic. Most interesting fact so far is that they manually bought all the .ru domains to sinkhole rather than seek co-op.,0,0.7969,0.20309999999999995,228
Man accused in fatal hit-and-run to get new judge url via mention,0,0.603,0.397,229
"Please stand up for bees against profit-hungry chemical companies. Keep the ban & #Savebees 
Sign the petition now:
url",0,0.7994,0.2006,230
*books a flight to Burma when country is enduring political unrest and a natural disaster* no wonder it was so cheap ay,1,0.19520000000000004,0.8048,231
mention please inform me of that date because that song very accurately reflects the panic of the week before,0,1.0,0.0,232
People who say it cannot be done should not interrupt those who are doing it. UO George Bernard Shaw,0,1.0,0.0,233
mention CONFESSION when I was little I had a hamster and my room was so cold it froze to death!?? OOPS......,1,0.1988,0.8012,234
IMAGINE A DOCTOR TREATING AN #EBOLA PATIENT WITHOUT EVER PLACING HIMSELF IN HARM'S WAY. url,1,0.3988,0.6012,235
Beyonce Is my pick for url Fan Army #Beyhive url 77,0,1.0,0.0,236
